name,review,contrib,humanized_timestamp,minires_images,stars.label,stars.value
F Rozie F,Okay have,Local Guide · 63 reviews · 73 photos,2 years ago,[no_minires_images],5 stars,5
F Rozie F,The place is good for taking photos,Local Guide · 63 reviews · 73 photos,2 years ago,[no_minires_images],5 stars,5
baim Journey,"One of the tourist destinations on Kumala Island, Tenggarong district. Kutai Kartanegara which provides information about the customs and culture of the Dayak tribe as one of the ethnic groups in East Kalimantan",Local Guide · 97 reviews · 392 photos,6 years ago,"['https://lh3.googleusercontent.com/geougc-cs/AB3l90AxtozD6a5YUkVhd8LeQBiG68FWC4E8GMA0FVhLt35dGAedkPQppTGaVCisEFIQD4x7Zr52aKo3L_Jd3owAbupGz1H0JPNQRoYiUvgTK2CG8Vj_PcCgtCjKhcf_4M_HaUJmnIg=w300-h450-p', 'https://lh3.googleusercontent.com/geougc-cs/AB3l90Bww0G5OK-9NunDAbbfYlqUnWXVZEw873kSKKaYsyl--yQK-Y6V3qCXFZi-X-Axfc4_Q0XYqjgz_FLkXFKxqxEeaO1aQ_ZARpTwk2_sjzSDPK2QmI2FFKz0ev0kP9RTHvl6EdzSHQ=w300-h225-p', 'https://lh3.googleusercontent.com/geougc-cs/AB3l90A-AfFbn61ZOfRnpNmUNRePJV349RgpYqeYJl8GqxH-dxyxGuLc0ll_sKh8pfs-0oFBmSa-fwQ80uZP14obU8CIaTUlcwR9Sc05P9uaycezfAGr5p2s4EVPTrRbaoQ77ICM4Ms=w300-h225-p']",5 stars,5
Teras,"A unique and interesting island located in the middle of the Mahakam River right in the center of Tengarong and Tengarong Seberang, Kutai Kerta Negara Regency is called Kumala Island or Kumala Fantasy Island. What's interesting is that this island is specially designed as a tourist attraction typical of Dayak culture, which is beautiful and unique, combined with parks and green trees combined with Dayak reliefs. There are tall and multi-story betang houses made from native Kalimantan wood, namely ironwood. There is a hall provided on certain days for Dayak cultural performances, music and arts. There are also swimming pools, fountains and villas with good road facilities. There is a unique and distinctive Dayak souvenir center with a relatively complete variety. The island is relatively large. To surround this island there are Delmans or horses pulling wheeled carriages.","Local Guide · 537 reviews · 3,098 photos",5 years ago,[no_minires_images],5 stars,5
Oktoberianto Wonodiharjo,Hopefully I can walk here again,"Local Guide · 711 reviews · 6,719 photos",4 years ago,"['https://lh3.googleusercontent.com/geougc-cs/AB3l90DW2mQXEXqmrYUaOjEMcPzss2PlqgxQbGd8YM_OEXWk1I2gL1IFY5WmC5SuV1tSzDpePCbUKGKN3Wrcn1N-4t5yR40oty9ZGeIsPhjAXUbOBykVKPccXZJWyvigmWf75ceF9Z3_Dg=w300-h225-p', 'https://lh3.googleusercontent.com/geougc-cs/AB3l90AnOY7D-7YjTHGn-UWwAuVs3-QBMztvHp15hggZzlWSKMJkDCsvhF9YJlSiUHc4jJVRTWzQdVfXUoXESLxG63BhtIU0QYqHeo4aG0_dJtJBuY_IPpeAK0pLF19PA8tKk1p160J1=w300-h225-p', 'https://lh3.googleusercontent.com/geougc-cs/AB3l90D52alqKZO4tbXUkxeS6EPq7PUnT5Vpw7Tm4n9sCQPhmZkti-6OwyzakONPzViNnZPonm-sctAKVL1ptQLMCbq51PTSyB92iw5urYBDaIb7rAYGAmCm-pIZcsi1_INoJ-tga4chMw=w300-h225-p', 'https://lh3.googleusercontent.com/geougc-cs/AB3l90ATtRPInBRkAngUe1zGyBxs4BZImQc3MfXhYMmchYGSm3pF2iFSBvHLZcVIAfAiiOIKBp2m29ACRzkFT2xhvcx12otdEYB8AT-SC64CUFUUhrlJV8Tja9YHBbZ0JhMYrwOdROc=w300-h225-p']",4 stars,4
Gustian Garang,"Amazing... As a Dayak person, I am very proud of the city of Tenggarong which is famous for its arts and culture",4 reviews · 10 photos,2 years ago,[no_minires_images],5 stars,5
Dodik mangun minaryo,"Spot on Kumala Tenggarong Island, a unique building but seems neglected.",Local Guide · 63 reviews · 93 photos,6 years ago,[no_minires_images],4 stars,4
kusuma prabowo,A location to get to know Dayak culture while touring Kumala Island,"Local Guide · 653 reviews · 2,768 photos",7 years ago,['https://lh3.googleusercontent.com/geougc-cs/AB3l90DggHWylV8abdHIKdEkRFspQ6AYq1yw7QqW8IQt6ghXayr13IZd4kFPcu6ziuift_9bmNhlrp0XWRqEdAFysICzmW0g_VLXzp8UYpx-yhqSxDu8tfK_l9jTJ_80IAg72enVgcvh=w600-h450-p'],4 stars,4
Kososi,Hopefully in the future it can be better maintained,Local Guide · 65 reviews · 354 photos,5 years ago,[no_minires_images],5 stars,5
Fuad,The building is not maintained,Local Guide · 131 reviews · 219 photos,6 years ago,[no_minires_images],4 stars,4
Christian N. Sema,[no_review],Local Guide · 7 reviews · 617 photos,6 years ago,[no_minires_images],5 stars,5
林茂全,[no_review],Local Guide · 4 reviews · 82 photos,2 years ago,[no_minires_images],5 stars,5
Ko Aseng,"Come visit here, OK?",Local Guide · 59 reviews · 89 photos,6 years ago,[no_minires_images],5 stars,5
Roni Mdr,[no_review],[no_contrib],2 years ago,[no_minires_images],5 stars,5
faiz gaozhan,[no_review],Local Guide · 247 reviews · 278 photos,4 years ago,[no_minires_images],5 stars,5
Adam Fadhilah,[no_review],[no_contrib],5 years ago,[no_minires_images],5 stars,5
Bagus sugiarto,[no_review],[no_contrib],5 years ago,[no_minires_images],5 stars,5
Amy Arifin,[no_review],5 reviews,5 years ago,[no_minires_images],5 stars,5
Hdr Kmz,[no_review],1 review · 14 photos,5 years ago,[no_minires_images],3 stars,3
Wahyuni Harliyanti,[no_review],Local Guide · 1 review · 1 photo,6 years ago,[no_minires_images],4 stars,4
Ari Purwanto,[no_review],Local Guide · 75 reviews · 34 photos,6 years ago,[no_minires_images],4 stars,4
Biji sukun,[no_review],1 review · 1 photo,6 years ago,[no_minires_images],5 stars,5
Is Andreas,[no_review],Local Guide · 29 reviews,6 years ago,[no_minires_images],5 stars,5
willy ryant,[no_review],1 photo,6 years ago,[no_minires_images],3 stars,3
Ceka Nizzu,[no_review],4 reviews · 11 photos,6 years ago,[no_minires_images],5 stars,5
A. N. M.,[no_review],Local Guide,6 years ago,[no_minires_images],4 stars,4
Adi Pratama,A nice island to spend with family. They provide nice spot to take picture with the beautiful Mahakam river with the iconic Tenggarong Bridge as the background. You can access the Island from Tenggarong city by walking on the bridge or to make it more interesting you can rent a boat,Local Guide · 34 reviews · 73 photos,7 years ago,[no_minires_images],5 stars,5
Syaif muhami shidiq (Kukirakira),"Not properly maintained, good view, only few rest room available, 2 or 3 seater bycle rent availabe here","Local Guide · 237 reviews · 1,685 photos",6 years ago,"['https://lh3.googleusercontent.com/geougc-cs/AB3l90Bi3A_9F8uA1w8QNna3e5K0n0pqOHlFEFOYfB9WJQgXrPgLl9jqlfqExQO2Qj6SFASDM-CXm7z-U23o0hegWe4FUIUtbjB__4Qw2GB0PI-FGa-vx6bjwc5DGCt1Obcq8z3NrdblUA=w300-h225-p', 'https://lh3.googleusercontent.com/geougc-cs/AB3l90BZwIcaLvqifsrTZqqLAWOfLqtLCCmzH8e6Z9FHXYMMRwms8oIyi4aVIFBVQAKSikPAvFpgkUQmthfyK-oqd7IupdkdZc_WXFpJqH3twYAfHHHcGWkD9X2lO5mnvj9tOWqSPGhR=w300-h225-p', 'https://lh3.googleusercontent.com/geougc-cs/AB3l90DOA0JhdQAEh7oyRAspdc5K4ecF9pRqZgUl6j-YAwNKxIqPtMK0VPZ04dQMQKO7Pny8j2OoKpGQPmlTinMiGq0kUb9kJcHHl74Ok9OliF1-7LkOacvBydQjtrL9T2D32x7wQZI=w300-h225-p', 'https://lh3.googleusercontent.com/geougc-cs/AB3l90Ao5Cmn0ckMFgUVqY1BQmOzjfUBsvM37_zYS_4mxq9-6ttWWMh7n7eQMbGS7H5I83ySfWUNIuiDRl2KfqEaUda2uQwY111NixQWazr3Sz0bMLTNWHvrb0LY8xVgT-vbefJD0loI=w300-h225-p']",4 stars,4
Mayong Mayangsari,"This bridge takes you to Kumala Island from Tenggarong city. This bridge is quite long so dont forget bring a hat or an umbrella. But dont worry if you don’t bring it, you can rent there. …",Local Guide · 94 reviews · 289 photos,2 years ago,['https://lh3.googleusercontent.com/geougc-cs/AB3l90CoTLCnBv4xBftuOqr3m4hNJIR6HaIAd6589gB9pfzQv8oD62y5yKmzO31l15F8B93X9sLlMRj_fVlK8zHN4VwSQSmjMqKUSuKbO5lmxspwpZSE5x21jgGSqaFFHInCr7UyXuIb=w600-h450-p'],5 stars,5
Baizura Ali,The main attraction in Tenggarong. This is a walking bridge that connect Tenggarong to Kumala Island. You can cycling around in Kumala Island but most of the places in the island is no longer active.,Local Guide · 27 reviews · 95 photos,8 years ago,"['https://lh3.googleusercontent.com/geougc-cs/AB3l90DBcsXirhycVXRzm6XNMvB79Ji7KG4AALlsrmpWWtyXSjfwQV-wY2tB5s9s7_6XWnSqo3cbmjElRZufHCAtASEGuFBFW9PRlBznidAfmBuINP8jpMITKQj5muMcfvzMJCmbYg=w300-h450-p', 'https://lh3.googleusercontent.com/geougc-cs/AB3l90CslC3Fkbsny_ITPAXV-kESOk6aYLWUDimuVIQw_KG5pCtUCBW4k68Q1Gz7CWDQgA6JKWVQhaI-MobM0IpheAnC-qhBGM786nLs6GoNrOrJXtb1WQU-Y1RlSE0ovfXFsysh5M4pzQ=w300-h225-p', 'https://lh3.googleusercontent.com/geougc-cs/AB3l90Dc_JrtNJlKpcbbYRjRJ6_OBCRiyDK_ffvHfZCoc8d-EA66bboBzFB00WD8soMOWndOW5uWCgPmwd1XbulGD9NXKB8v_B8rCPRDMkxjsXTYtDjSPcDDfV43zM-ysttv0HLk50VD=w300-h225-p']",2 stars,2
Anwar Effendi,"awesome and functional infrastructure to increase Kumala Island tourism, the bridge itself has aesthetic look, there is also parking lot if you wanna walk at the bridge.",Local Guide · 364 reviews · 952 photos,5 years ago,['https://lh3.googleusercontent.com/geougc-cs/AB3l90BbiLGjuam4fZYgH3FFG40DWg-VuPjvmDEflNAVNHLhy2Bz7ua7GcsUxBoIMt1rWSHwycbG1IQeX44fnwLrxo4081q-_4wSQ0GDFyg7Fv6ZhWIV-TlcXH4vnfCatwqH08fMxj1KZg=w600-h450-p'],4 stars,4
Andrew jaya Kantono,Nice weekend trip. Pulau Kumala has improved a lot. Unfortunately the kereta gantung isn't working and they still have the bushes.,9 reviews · 3 photos,7 years ago,"['https://lh3.googleusercontent.com/geougc-cs/AB3l90Bf_43quscrBrl_qLprVL9dNHZj_MT5b3pkItEC9YakwOKkETJS-kHyFX1Q1v7pdkJeWZ1WWrXMtiVd3MN8r4tlQKOuQ5J8B96urY_J5sqHVxxmoF2QXKRoS2Xm4M49gOHZhhaa=w300-h450-p', 'https://lh3.googleusercontent.com/geougc-cs/AB3l90BLxYM2mPpApfCjVMqb94YmPBobtRSEaS5w0ZgK6YLvfuYPQ5GOUo5vNaZUpxxw-o7RD0nyx6EfyZeMuAKqu4510eZjbkjC5W8e4IFK0WU0jq-UPpdT1n89eglKf9SuDxmgkVbd=w300-h450-p']",5 stars,5
Ade Mardwiansyah,"Good place to spend your several hours with your families or relatives, cause this place is really need more development to become a proper theme park.",Local Guide · 6 reviews · 25 photos,7 years ago,"['https://lh3.googleusercontent.com/geougc-cs/AB3l90C4zG9VZjuQQWIk0QMVF1eUHHo7DzQKeUPFniBPPBbXl4KKEUZwTDo-iJIjEU3jee72m5LLuhMz7jlJ9kJhO0VZvrlO2zsVSKebKGo6mgrB3K7Iy6K_4YViRZbyANL1qOLD_dOOQw=w300-h450-p', 'https://lh3.googleusercontent.com/geougc-cs/AB3l90CsoCgzsy-jF9zAZf82a5eeTYydhLMLa6GQg9aJbq-kMVSOC5hRk0nx1ifKdILxH0-IsQdQX-8Bdh8jl0oieS3Y7ay1h7RtdozMJBPwOjUqw55d_FHV02Qo2267OyOKpGB6QGMNew=w300-h450-p']",3 stars,3
AGHA,So many spectacular views. Love the Kutai Kartanegara Bridge view so much. Too bad too many abandoned buildings,Local Guide · 344 reviews · 814 photos,4 years ago,"['https://lh3.googleusercontent.com/geougc-cs/AB3l90C_Ph2359N7tgOcT-nW2ZnrfaHNSlUrKRzPcndaS9Lui0NF8WqcjGVf8LLAcetb3iM_hPU6S3rYHPt-5YJpMogMNRsYB5RIuUzPDzTpXBPawQzCIngKmdsvYpRm3tVGPNdaQMz9Vg=w300-h450-p', 'https://lh3.googleusercontent.com/geougc-cs/AB3l90Bc-_B60777TR3enkIiR4iNMbxe72N3cBstpYnN_YpcLCGTeZVOLeQ9kQwO6l-ttbPyn8QWEFCNMQLh3JE8AwrK2Ct0tzrWyhMI-U_aVtATVgCBzHoLADFjTTlPqVJ0I_nE_eg=w300-h225-p', 'https://lh3.googleusercontent.com/geougc-cs/AB3l90COWXJfBDYzIfmdeU1Q8YBK-Vs6p3AxkUGy6VZHEUjEAE1oxoT8ua0kePkQPb59rL7fof8o5CHnCO340-JlxZ08APOzORObsTDBR0L_C9q7YHOpklEJ6vObECKx_aVR10udHoK-Iw=w300-h225-p']",4 stars,4
Reza,Good view in Kumala Island,Local Guide · 12 reviews · 60 photos,6 months ago,"['https://lh3.googleusercontent.com/geougc-cs/AB3l90CcDdBJejW-eoxYHXuyW4Al9nR_uc_qwwIUTrCZsADhM5qk5M-lEOqu82dmUkn9y1azMBeLGCMT0Y_lMS4SK4OerjU_WQg4FY5hdVQegTJS-kRREU2N1W5JzZTQu5cRuQFK_N4=w300-h450-p', 'https://lh3.googleusercontent.com/geougc-cs/AB3l90BEXbffRxkJKWa-HOq5yUKE3WUEC-DZfjIpCCzB5kxHUivDMqG865MABaw_FvX0oDR55t5_1IN5P3rHRpFTxO4-BJ21_SHhBJvCuB4MCJyr3zrlw70WfmqMm2t28CHAunwyskUm=w300-h225-p', 'https://lh3.googleusercontent.com/geougc-cs/AB3l90DUJaxeFANBqjkHsgS1blkNscZipO1jYEL2sQUgxA9nWgPR-s8dlSlzM2ReBrnTcBY3XkEw6q2DXVNKPU498v9ArYTpMszMknrU8o-7JDiKzevHji9vySxvVO97_X-G3C-xIFqf=w300-h225-p']",5 stars,5
jimmy sallan,"Pedestrian bridge to pulau kumala as the background, an island in mahakam, just a short walk from water front of Tenggarong...","Local Guide · 209 reviews · 4,357 photos",6 years ago,"['https://lh3.googleusercontent.com/geougc-cs/AB3l90ARviHX-PUUCIbcgcQew8oSrZcxxvUzkL83aa1npU5xiS5q74Yw4dUucsqJ5mVvSCBdQoWK1-NRrgq81-m1Ic36RwsEr2tSuDhoANL-bQRDr-1KjHSS1nDAhwPD6RvTduDbAE9l=w300-h450-p', 'https://lh3.googleusercontent.com/geougc-cs/AB3l90ABKVXVPHU5rSlVGMmtM0hDZXwVhApCspjiI4wa5J8JGvxaI8Gy6JcyLW_0EkAd3hlvlvjLHjap64wXSU_GdX63jik9lw-dR0fuE0O9WcdWLt03ZJzuocN_YvbIyCN7UkGCMxAp=w300-h225-p', 'https://lh3.googleusercontent.com/geougc-cs/AB3l90CdH2ayOKRdrCatp3xle0V7WJ3uSi49uFd0Qe5PmjEy9ArKWLaIp_Uf_phU7Co6pojarCtWx4WROCZFFm7zwOK63Czupi2NffTBMCcWMkjFNIfOIGhxGAAfo_WIXSW-YBr5HG7K=w300-h225-p']",4 stars,4
TasMan Channel,"Repo repo bridge is locate In tenggarong, Kutai kartanegara Regency, east Kalimantan. Beautiful bridge with beautiful river. And this bridge only crosses by pedestrians not for vehicles if you come to Kutai, you should visit this bridge to see mahakam river","Local Guide · 161 reviews · 3,062 photos",6 years ago,"['https://lh3.googleusercontent.com/geougc-cs/AB3l90DyGkFd7IksM8C8Hn8LBsR7xDV0tjRNHbmYsx9hoUvIdBM6kSfx5S7RV9aPUX7bDx8t4PIFbOA6j9bnl_fNUGZbMJTZcxwu_RnzBmmykoN3LjEVYM1sR140lyEZzLRNIa1QYqwpVw=w300-h450-p', 'https://lh3.googleusercontent.com/geougc-cs/AB3l90CPspEzAflClAkQPZcOeqr2uF3GDf-7G_v_CvD8um3hX32RhcHjPT8JNSxEwCAX_PNykMJnvo6_PEcSbr1uM5eow5VcKXlyI_RqEyE1KSt9a_HLjqopYY90x40HkIS5Z-4Np0Qh=w300-h225-p', 'https://lh3.googleusercontent.com/geougc-cs/AB3l90BiG_hhiYspxurjhOmjF3ZE06JsV-4HubEZoQ0ZCwYjib_c3yzlVwx3bXBaTuqwJjrNH6HvR5M7PLUtdKCYZvY2rhNVql5_syU4iBZ0fflhP--HhMcreyFQWjXcZlExggOi9Km-aQ=w300-h225-p']",4 stars,4
meyliani rophika sarmauli hutahaean,Nice enough. But maybe need to more improve for the important area which is just a Toilet,Local Guide · 16 reviews · 27 photos,7 years ago,['https://lh3.googleusercontent.com/geougc-cs/AB3l90ADeTL882lNSp5HDYjL2vBvmO6gsNvKleMprgiYLGGN16pLEQlTBDqxI_seErWJDNhkaiovqs_ZD7D-6BD7KAT1Y0lKfxs7NtAy34N5JIUOd6MFq5HTj01ty2pCRnYSSFh8Gy4Q=w600-h450-p'],3 stars,3
Siti Muallifah,"Same place with different scenery, enjoy the Kumala nowadays",Local Guide · 227 reviews · 884 photos,7 years ago,"['https://lh3.googleusercontent.com/geougc-cs/AB3l90ADB4x0qKSPkjsFBopXpJE4go6Di6RLBLIiUiUFJxVuVI8U1nZdG3hxkvm7qnSWx8taQ-35IU9wwkGBFYyo02j7ouyFOkVA8KrDSWWkzA0IrtJiOuAEWBUhezcGUZcActYWwfE=w300-h225-p', 'https://lh3.googleusercontent.com/geougc-cs/AB3l90BEq_Q5CCGEf-wuzZ5ZHTdf5KARgiiCe7QpxowCx7deQMDL2O656e4bARbvNTo00IinvEAMmh2rdYGjPRlG6XMgsy0_mUEWh6MI9nMesOakomQx9orbxGnd91tsq7PU0btpJopu=w300-h225-p', 'https://lh3.googleusercontent.com/geougc-cs/AB3l90BRpLP-5h3yYHIfTbqyQBw5EpWlH6gzYZ4orA7kHtFcvspwsSbNyzB8Ohf-QlbMz_3LDDIO5qLgo8_WVLClmBIR9-fee9omBbW1T81B6DO5Q6h39O0fN28P0muwwzSN0MMPVzSV=w300-h225-p', 'https://lh3.googleusercontent.com/geougc-cs/AB3l90D7DItKc_0NqBaZga7GfvvOE0taO7oUlUCtZMD6ZG_75KqOUkatS2GSqJ3SkSfAYQCR7dTcHSGQpvvINDtuKDiieK3Yi5V128AygK-yPocolJM5LCmaRJln-bjxtbOM8xZmQnU=w300-h225-p']",4 stars,4
rama lana,18/12/21: Bridge is still ok but so far no access today,Local Guide · 216 reviews · 330 photos,3 years ago,['https://lh3.googleusercontent.com/geougc-cs/AB3l90AyJDBLgXagbuA3r2ekzHHa_M5owMPGebh03YiWqBtFoTlsNF4sUh0xm31uvnNU7-ln_l8tsXKRzW3oYyQREsZixB9iX-O5Mth_RlFm27r4K1RoFPbV0rXgSXrRpoS0x3xq5Ew=w600-h450-p'],3 stars,3
Liliana,"We visited on the weekdays. It is half close.
There is only 2 food stalls open.
The bike rental does not have fixed price so it is better to bargain.
The place is not well maintained and only crowded during weekend or holidays.",Local Guide · 156 reviews · 942 photos,6 years ago,[no_minires_images],4 stars,4
mika cethy,"The island is very unique. Because it is in the middle of the river Mahakam. Unfortunately, this facility is less, like a tall grass, and arena games not active again. But, This island is very Big, and Calm.",Local Guide · 16 reviews · 21 photos,7 years ago,[no_minires_images],4 stars,4
Anoop A V,"Pulau Kumala is a nice place to spend evenings, it is sad to see many of the attractions were not working when I was there but worth for 7000 rp entry fee.",Local Guide · 85 reviews · 84 photos,6 years ago,[no_minires_images],5 stars,5
Bakti Hamli,"For local tourist, all facilities still useful n fun to visit, but for outside town tourist like me, many aspect n interesting place that need to be improve & gain full support from local government to make all places so interest.",Local Guide · 36 reviews · 15 photos,7 years ago,[no_minires_images],3 stars,3
Tyas HMH,Nice place for strolling around.,Local Guide · 12 reviews · 19 photos,a year ago,"['https://lh3.googleusercontent.com/geougc-cs/AB3l90D1wjClDHDGR4Xv6o4ARyBhAOTTtvL5hGzOxzQkZzWMdYJABEoTdTEP3_z4cQfwaioT0KYHbm5Yb-KHnuvNfDBhY2DC7DkWNKqNf6sfrrV34-uURVWuh9as_WgxCAk5yOSIWDhD=w300-h450-p', 'https://lh3.googleusercontent.com/geougc-cs/AB3l90BCrXzTqQGVIjpFnT4t-LMj4aAEr7GJeYrhqXJjHUtQUyFB0iYXxotyGxtB25clwVdeqvnK65gEqazhxNTK5zzPmfoGqjGoSPC50LFdNtgzPMxTe_0o9Gvrlwff46BjarGzO9DhQQ=w300-h450-p']",5 stars,5
Retno Susilawati Wibowo,"It was beautiful but heart breaking see all those buildings and parks, abandoned. For me, its just fine. Cause we love the view, the trees, the birds chirping.",Local Guide · 31 reviews · 4 photos,5 years ago,[no_minires_images],4 stars,4
Shilfi Safitri,"The good place who to find different ambience, you can get traditional handycraft easly but sometime they sell it little bit pricy. You can rent bike to cycling round the island",Local Guide · 35 reviews · 115 photos,6 years ago,[no_minires_images],3 stars,3
Andy Sidharta,Not bad,Local Guide · 46 reviews · 256 photos,7 years ago,"['https://lh3.googleusercontent.com/geougc-cs/AB3l90Buf4Ww7Xkw7-Z5Ag0JzRzD-nP-9F21pXhbfQ_k59FMDikiFSXlJWgKVBr8L6KqgJj5vqcrHLBlN8r8aalA48HKcfkjmKi-32vCnlSplYNirlNRCRyrA-FI0eliRC8f1sUNELXBUQ=w300-h225-p', 'https://lh3.googleusercontent.com/geougc-cs/AB3l90D8wjT9I7QfGfhmuf0LZ-ymqvOgl9d_d1kBfUxMRzr6i6KC_0_y2ejit1Ka6ECihHuAeaXwdal-PkUp-aloO4z9csW5xisARgI6aK9iqcI4AzZEBColIdbwMTDzXLgWxzViESc9=w300-h225-p', 'https://lh3.googleusercontent.com/geougc-cs/AB3l90ByvnzvbWOeZR82jM10gh0u1Dll6GSL3_qn4OpAYsun-M1AbHSvT565RHxXcfpycTreUerI55rbDtGCz-Q-rfWla5xqaFmyVrd8EP1geEQBwosTSOjGOMnE7hru8YP4DVe7JVqp=w300-h225-p', 'https://lh3.googleusercontent.com/geougc-cs/AB3l90DzTTP6Uo-gcw8hXwTmgyC4IdDPrdzk4oDCJMvjhfIdWO6qV_NKtKWd-cjMGhiwMBkUOAa5WmQC5sWWXkreN2bwufpCBI6Uk-MMAZLMJbU0YbJV392PY8lVDw_8aSu6MBdZn1w=w300-h225-p']",2 stars,2
Aswin Azis,Should have been maintained by the local government..,Local Guide · 53 reviews · 29 photos,7 years ago,"['https://lh3.googleusercontent.com/geougc-cs/AB3l90BGfGmwzgkI_WzdOl5nqXcb0dOeOexT2C61BCcmGRKqQ4Nssl9YiqoXbezYA7X_6KIGb1jABq2ajbtlbtUZbCCVhm0BDhwWiiD0LIxsvXKoOq9Vpqjr0vwkZRgo51vBawx3BFw=w300-h450-p', 'https://lh3.googleusercontent.com/geougc-cs/AB3l90C4P9DRK5xEKd3o5C3QJkjEkNYq1uErSupNJtT3WMs1fV1sr_GxiwZF3j-0GslR-62SI5mclCMAIR-sXYvNaxYzP5PSitLVyiKpGhLwwKIqSV0HJa3OrUV0STtvFnMxV2ClxBg=w300-h450-p']",3 stars,3
Nur Aini Haryati,Also known as Repo-Repo Bridge (Padlock Bridge) because couple may set padlock on railing of bridge as symbol of love. You can rent umbrella because it's very hot at noon.,Local Guide · 153 reviews · 404 photos,8 years ago,[no_minires_images],5 stars,5
Lies Permana,mahakam river view. so beautiful,Local Guide · 218 reviews · 630 photos,8 years ago,"['https://lh3.googleusercontent.com/geougc-cs/AB3l90DWBjOufsg3aNS5eh3H3Hn8WuzLoAJAWEeLFjrap0WTZkzabZJv6zZSYLwmJw-Vu-dtHqfIjAC-8VysppZNA88BGDIRXuX6gY0U5fMGZCV40GMf_LRmd0edZwnWd-T4Wc3kbq0N=w300-h450-p', 'https://lh3.googleusercontent.com/geougc-cs/AB3l90CidxgUi3hH6gt6YeqAGpLqh1hw7BpnA04_5E9HOO3gvooqka9niivR0h3OnIN1-WilXxoIcxcOaFYQW7rp9-zQb1Y4QNPa3jG1W_klZW6ESWORGfc-WJ5bUtyoP9vNmdUCJRjn=w300-h450-p']",5 stars,5
Yusak S.A. Nugroho,"During pandemic, nothing much you can see",Local Guide · 132 reviews · 151 photos,4 years ago,['https://lh3.googleusercontent.com/geougc-cs/AB3l90BpVgEIR2_xeM22OEOAhbu1KVXGzSnH2nwdEl7EBGqzrk_eYEXnUlrv6JPni2JTtL6VmtIDVs0Q50-U5dcMDo4fB39RqcPE2usHFRIe1m8Ih9Mbj9xovGdZhWe4-LbkLXmG-l7q=w600-h450-p'],4 stars,4
Pedro Pascal,"If you wanna go around the island, grab a bicycle quickly or someone else might grab it from you and you have to spend your time walking around the island.",Local Guide · 21 reviews · 11 photos,6 years ago,[no_minires_images],4 stars,4
Ms Wayan,Nice view & perfect day,4 reviews · 7 photos,5 years ago,['https://lh3.googleusercontent.com/geougc-cs/AB3l90AFRKpkx6hLKXok7xtkZAOXE3V9669VV0igaomtC90YEVQhD805fMHoYN841GNEwA0Ewh9-sabBdfOVs3ZyS3yOXjNStn4bs51VA3UJGT7uC6fKzD0SuqJRssI6hiMdU8jkU_GH=w600-h450-p'],5 stars,5
rachel ratna,You can see beautiful scenery above Mahakam river before enter the Kumala Island,Local Guide · 71 reviews · 3 photos,4 years ago,[no_minires_images],4 stars,4
Indi Ind,"Hmm...I don't really know what's so great about this tiny island..maybe its unique, in the middle of the river?",Local Guide · 182 reviews · 8 photos,7 years ago,[no_minires_images],3 stars,3
Erwan Tanajaya,"Beautiful but deserted island, the local government need show more love to this place again",Local Guide · 14 reviews · 20 photos,7 years ago,[no_minires_images],5 stars,5
Joey Chensiuhua,Interested children playground and family instead the restaurant or something like that are far away (other side of island),6 reviews,8 years ago,[no_minires_images],4 stars,4
sutikno12,It was nice but unfortunately some facilities was not mantained well. Need attentions from the government,Local Guide · 29 reviews · 85 photos,6 years ago,[no_minires_images],4 stars,4
angela erly,Nice view,Local Guide · 151 reviews · 211 photos,6 years ago,"['https://lh3.googleusercontent.com/geougc-cs/AB3l90DYO2PPqF351dUOp8INW1EQFZqZjbnU-sGOKM_Gj7gLBsEFcr6yYdlKRhJH95-bjF78lQM_Fsds4B5OVbOx1hXKvXvrFSRUiQJJJxOswKSLWUNOH_sEW8_X7cZNkDK31NI7jEda=w300-h450-p', 'https://lh3.googleusercontent.com/geougc-cs/AB3l90AKrWCfnQPHIr8pqdY00S_MRtQbtazMCSjWiSOWjYFel6pfMH1zIW9zuTtuWRXxG1kqEPovst1u78aikP1T12cG7lqALojj3-UgEtyCGj-gvXvMKQMQQr0EX_LQuiU5EE5Mnpxo=w300-h450-p']",5 stars,5
Pipit Vidiawan,Good family holiday destination but still need to upgrade public facilities,Local Guide · 54 reviews · 14 photos,8 years ago,[no_minires_images],5 stars,5
Yosafat Chandra,Nice place for refreshing,Local Guide · 10 reviews · 17 photos,8 years ago,"['https://lh3.googleusercontent.com/geougc-cs/AB3l90BiKZ6S6_0XY1LkGPmRfNWsSmTIaPMfZNhSAa-Q0ilnB7GSxnGs45rpbTa3xPmCvUPUilMqanWQ8TgR6wxliqTFfam2oNxPcJzVvVlthFs-ZUab_mpds3BzZcGeMrq4gUVPeb9F=w300-h450-p', 'https://lh3.googleusercontent.com/geougc-cs/AB3l90B9DB8vKSWQHB80TI_OF7yqaLAqSfdt5yyPqsLtOzxv4s-HeQPC_YJaowk1rfRkdVjmPZY3mHIzBHbvfjaIR30grUSh6u1YrOz9r_zDn8LzfQbGn4xOf09MO4KH57KMP3JpYS6L=w300-h450-p']",4 stars,4
Aspian Sheva,nice view,"Local Guide · 193 reviews · 3,055 photos",5 years ago,['https://lh3.googleusercontent.com/geougc-cs/AB3l90DW2DY5xZgCxBL587YGXNgcPUoZUgZOU8Wk5wmT83QkGDFhJmCo0sllDJ8cteXzNO5RBWIQeSV2FNyTCnjpIw8DkqjOsqTtgqZLHQXh4T7uBV1yyK0SQpDPchX95NaDPwMX0vWc=w600-h450-p'],3 stars,3
Jarot Sutriadi,Nice view,"Local Guide · 139 reviews · 1,039 photos",6 years ago,['https://lh3.googleusercontent.com/geougc-cs/AB3l90A4OGlvxSiYkXgbUWteYOxBiydvzslshfciA0ICy-39l3QPjWbwTUFQtHct1O_cpJ8I6uGl3SMGhHLC8rB8ERxqaCN_gF9flDO_BF-STGf-iJpmSV1t5aaZUk-VWrEdIGvtNPQ=w600-h450-p'],5 stars,5
Agus Ruswandy,"The Great place for business, traveling and have romantic view of Tenggarong city",81 reviews,8 years ago,[no_minires_images],5 stars,5
Cornelius Kurnia,Beautiful East Kalimantan,Local Guide · 6 reviews · 8 photos,2 years ago,"['https://lh3.googleusercontent.com/geougc-cs/AB3l90B3CoDjgNC-_c4JoFkTPg_HHNNn4ZzIhMIJsrFNZJtRWD8mQGIEoAqsKPZhMh43J13RtAYzE2OWCOaQwNN9NToDmipois63s3NbBjYomjguWpOWuo8_w9hbkkoe7SHZnnbY688=w300-h225-p', 'https://lh3.googleusercontent.com/geougc-cs/AB3l90Dwoul8XGdQiYR3UKTmNI3TGDGe8H5oEDBrkAIGNttI7u22FZTIpFsI0FM8AP52TwLc-XL2U_PKfET0tDqMykHP4isjWEQUvSBiQpoKXaLMPgLYiBnVyik5J2pDvzjLs1e3RJrLgQ=w300-h225-p', 'https://lh3.googleusercontent.com/geougc-cs/AB3l90CWNl1LiJZ4q0TjVDZAx4iyI8qT2I3xUEVJEqh_yJijkKEqjF9UoOCk0Q4cjvDgMtffYThRPrB97SL1eqQwimpzHsG8pXdwVPu2URNgse4UIS2IZ9Hl7d58IP05lsgP0NJ8S1I=w300-h225-p', 'https://lh3.googleusercontent.com/geougc-cs/AB3l90Df1fltuZIcFGb0SEij_DAJ8psOz_EsEDld3eiseFNE3kcw25Ep7zP07j16v0qC6IFfImzvrwp97SaOWDm7sDjbcTMcD3KKE96tYw9SZSFa1E8IBL7d5eSIVCaAcg01z5QZDUQ5=w300-h225-p']",5 stars,5
Ufhix,If you tourist from another country I suggest you take local tour guide,Local Guide · 127 reviews · 180 photos,5 years ago,[no_minires_images],3 stars,3
romy antawirya,nicee,Local Guide · 108 reviews · 147 photos,3 years ago,['https://lh3.googleusercontent.com/geougc-cs/AB3l90AkzvyaN2hu_bl8UbS3GpLdW8ojsCuwpeH0TIieSd-5Heq5IM8gpis-k-AxepShRVg0f2QlVNkU7U-WUJJrVKMW9WP8ubFogWO7uKDaroi50EmGbO07961P8_hzY4U_soufo6OL=w600-h450-p'],5 stars,5
Amalia Suci Rahayu,Good🌸🌸 …,2 reviews · 1 photo,6 years ago,['https://lh3.googleusercontent.com/geougc-cs/AB3l90BCdjxw5IzJZQoniB3COJ2qQI5rnmxizXShzWaWzwMOnm2Hq_vTrdVY_fOpmzBmWU_-VSrBISXcp2qBdFquaTUFRw2efmfGWHXFjR2SsdEUKCgC1L70_6En335SahlaDqzHDxP8=w600-h450-p'],5 stars,5
Lany,👌👌👌 …,Local Guide · 20 reviews · 23 photos,6 years ago,"['https://lh3.googleusercontent.com/geougc-cs/AB3l90AC3lP7od2ssPzZ1kIhqhAb9u8WRa2ZpACxdx8dbrL2dzE8fjA7UMv4NmAL-n5rkbzArSYnX-dPvfRmdkYQ9faF8QRk8qmqd5EDz7OadNZY1fUOCwmdyWmwz_oV2tXgCtiuuLzRVA=w300-h225-p', 'https://lh3.googleusercontent.com/geougc-cs/AB3l90B9FoS9OZ-ryB5101WePZSxBEBIDm18i7Mv4c5yxySVqNCJWVxLjyS9PqMZVUtncdj8s4cymgvZn3rBeMCe7FRhnpfySxDnQIJ-sIbhxesvZF5PcOB9qFic7jdAULKanqkBbFpMyA=w300-h225-p', 'https://lh3.googleusercontent.com/geougc-cs/AB3l90Cs6XqFw-K6EIiKIiwO9se9eoXaWDwanyBAUUPG1z6-70TJ5ru69adb2TGUHjGexTs90M8_A1Exxbo1eUrZNWwZhoy5qSwoHyGiiXoacF5gsm0b19nLgGaz0YKx1HKipybLXnCtVg=w300-h225-p', 'https://lh3.googleusercontent.com/geougc-cs/AB3l90CQJynnmf7qdCAmbw2Ax2pVg2mV5Fm-plup9lpn00HNnAmXaKXsaXW0FSBswCrSdtkzplLHFQGk_Wt8aYrHnL3-qIcUhzk-m48f2PajntMcBmBb_x63shr7H-66q6o-D6Mhdn0f=w300-h225-p']",5 stars,5
Syam Ajmal Munir,"For a while, u feel better. But actually u're in Bridgewater",9 reviews · 2 photos,6 years ago,[no_minires_images],5 stars,5
Marisyi Minandar,this place very good for take a photo and upload on your social media,Local Guide · 32 reviews · 86 photos,6 years ago,[no_minires_images],5 stars,5
