name,review,contrib,humanized_timestamp,minires_images,stars.label,stars.value
Alfin FM,Good family vacation spot...and a relaxing place,Local Guide · 69 reviews · 283 photos,7 years ago,[no_minires_images],3 stars,3
Aku Wae,Mak Nyus' food... 5 star service,Local Guide · 10 reviews · 34 photos,Edited 6 years ago,[no_minires_images],5 stars,5
Chanel Minimaha,"Busy every Saturday, Sunday and holidays....",Local Guide · 164 reviews · 113 photos,8 years ago,[no_minires_images],4 stars,4
Dedysusanto Susanto,Because the place is nice and clean and nice to look at.,1 review,8 years ago,[no_minires_images],5 stars,5
Valentine Noya,Tourist attractions to Kumala Island,Local Guide · 16 reviews · 4 photos,a year ago,[no_minires_images],5 stars,5
Dedi Jito,Need attention from related agencies to make it more stable,Local Guide · 42 reviews · 3 photos,6 years ago,[no_minires_images],3 stars,3
Junaedi Solo,An extraordinary bridge stretches over the Mahakam River,Local Guide · 212 reviews · 444 photos,8 years ago,[no_minires_images],5 stars,5
Rinto Nugroho,It's good but it's a shame it doesn't have a roof hahaha,Local Guide · 23 reviews · 13 photos,6 years ago,[no_minires_images],5 stars,5
Ijum Lyanti,Vacationing with family here is really fun,2 reviews,8 years ago,[no_minires_images],4 stars,4
Loviaa peach,"Preserve, appreciate and introduce our tourist attractions",Local Guide · 32 reviews · 6 photos,5 years ago,[no_minires_images],4 stars,4
54ND1 N4UF4L,Very good indeed,Local Guide · 86 reviews,3 years ago,[no_minires_images],5 stars,5
salvina andriani,perfect for a holiday... for good photos,Local Guide · 106 reviews · 119 photos,6 years ago,[no_minires_images],5 stars,5
anang widodo,"Quiet and peaceful, good, needs improvement.",Local Guide · 79 reviews · 134 photos,2 years ago,[no_minires_images],2 stars,2
Nur Cholil,Good place to take photos,Local Guide · 65 reviews · 98 photos,8 years ago,[no_minires_images],5 stars,5
Vita Sari,Beautiful at night... filled with lights,Local Guide · 59 reviews · 15 photos,6 years ago,[no_minires_images],5 stars,5
Komunitas orang Merdeka,The bridge connecting to the Kumala Island tourist spot... Cool,Local Guide · 69 reviews · 11 photos,7 years ago,[no_minires_images],4 stars,4
Arman 78,Wheelchair user path to be built soon,Local Guide · 14 reviews · 21 photos,7 years ago,['https://lh3.googleusercontent.com/geougc-cs/AB3l90B1QXX5oRIjmemLt19wAVrAR8wQ0IHyLQP7kZSuzg4eNFmTea4bUYvC6vUKEQm-h48keEazG3mjtWLAy3zWg5QBB2T8BR9bfNa3OPjzW4Cuosg7mBPaC0Thz8MwyA4vAmbvrQ=w600-h450-p'],4 stars,4
achmad busiri,The place is good but lacks management,Local Guide · 19 reviews · 1 photo,7 years ago,[no_minires_images],5 stars,5
budi yono,"The beauty is extraordinary, clean and well maintained","Local Guide · 31 reviews · 1,199 photos",4 years ago,[no_minires_images],5 stars,5
Sukarmin Sukarmin,Good and should be taken care of.. More,Local Guide · 15 reviews · 7 photos,3 years ago,[no_minires_images],5 stars,5
Shahrani AW,Good view for selfies,6 reviews · 11 photos,7 years ago,[no_minires_images],4 stars,4
Yulian Syah,"Rapo-rapo bridge, a tourist spot on Kumala Tenggarong Island, East Kalimantan",Local Guide · 27 reviews · 87 photos,Edited 6 years ago,[no_minires_images],5 stars,5
Mariati Herlina,"The island is so beautiful, I want to go again!!!",2 reviews,8 years ago,[no_minires_images],1 star,1
Leny noor istiqomah,A place to hang out in the afternoon with friends,10 reviews · 21 photos,7 years ago,['https://lh3.googleusercontent.com/geougc-cs/AB3l90BOeCqHEATOsMz_d3kN5fRWQPe3y8eOR88kPfNAD4bKQGFGP4ktJ_h15ur2oH8OtPhjuiyUb5cqewKWQB5szPckd93TPEf4FSMZe7CVN_Tmtgccxc5MdmUzrbSMosBfghzbDlfK2g=w600-h450-p'],4 stars,4
jaka arif,"Come on, bring an umbrella",Local Guide · 104 reviews · 117 photos,11 months ago,[no_minires_images],5 stars,5
Abdi Adia Revandi,A great and fun recreation place,Local Guide · 4 reviews · 38 photos,8 years ago,[no_minires_images],5 stars,5
Muhammad Fachrial,Unfortunately there is no path for the disabled,Local Guide · 115 reviews · 16 photos,5 years ago,[no_minires_images],3 stars,3
Sarne Dianto,"A place to have fun with friends, friends, girlfriends and family",5 reviews · 6 photos,7 years ago,[no_minires_images],5 stars,5
Eko Cahyono,One of the most prominent tourist attractions in Kukar,1 review,8 years ago,[no_minires_images],5 stars,5
Alifah Razanah,The view from the top of this bridge is so beautiful,Local Guide · 43 reviews · 280 photos,6 years ago,[no_minires_images],5 stars,5
Mhmd Fahlevy,Sunday morning✨,Local Guide · 64 reviews · 196 photos,2 years ago,['https://lh3.googleusercontent.com/geougc-cs/AB3l90DuF7AIclhpxDJv1u1lmIVHjhYaiilpVwnPkf0w0acQMj7BKk0atVcn6JAxAw6SKNjaj2DkRDiJxRg8n0aZAnEgzg4jBa2ol0_gnSa7RIexFVrGr9SLQz_zdSMXl8mmqEcC8uRH=w600-h450-p'],5 stars,5
Ary Lutfiansyah,Suitable for bringing the family and recreation,6 reviews · 11 photos,8 years ago,[no_minires_images],3 stars,3
Jairin Akhmad,Unifying the Tgr Sebrang and Tenggarong city areas,8 reviews · 2 photos,3 years ago,[no_minires_images],5 stars,5
Dosi.agussupriadi@gmail.com Supriadi,A comfortable place to relax with family,1 review · 1 photo,8 years ago,[no_minires_images],4 stars,4
francisca elly,"The place is nice, it's a shame it's lacking maintenance","Local Guide · 238 reviews · 2,065 photos",5 years ago,[no_minires_images],4 stars,4
Basuki Rahmad,Waooo.. It's a loss if you don't go to Tenggarong.. Mantul is finished..,Local Guide · 135 reviews · 18 photos,6 years ago,[no_minires_images],5 stars,5
Yusnia Wati,The place is easy to reach from the main road.,Local Guide · 22 reviews · 15 photos,6 years ago,[no_minires_images],3 stars,3
lula vlog,Very suitable for family recreation,1 review · 5 photos,8 years ago,[no_minires_images],4 stars,4
Yamo 056,It's hot now... if you come here it's better to come in the afternoon,Local Guide · 48 reviews · 18 photos,6 years ago,[no_minires_images],4 stars,4
Muhammad Farhan,Cheap and safe family recreation place,11 reviews · 2 photos,4 years ago,[no_minires_images],5 stars,5
Saiful Wahap,"The bridge is cool, but it's quite tiring to cross it 😀 …",Local Guide · 297 reviews · 255 photos,7 years ago,[no_minires_images],4 stars,4
Barito Badminton Center,Bridge crossing to Kumala Island via foot,Local Guide · 142 reviews · 167 photos,6 years ago,[no_minires_images],5 stars,5
Muhammad Taufiq,Presents views of the river in the city of Tenggarong and its love locks,Local Guide · 31 reviews · 8 photos,4 years ago,[no_minires_images],4 stars,4
Cak Yud,The view from this place is good at dusk,3 reviews · 8 photos,8 years ago,[no_minires_images],5 stars,5
Muhammad Firda Fata Albana,Hot 😄 …,Local Guide · 141 reviews · 70 photos,6 years ago,['https://lh3.googleusercontent.com/geougc-cs/AB3l90BAlO22S-wJRyQ013V2lYACvcYXUZnRu3Wd8iTcVz_ullwu9EDVnCJTxqAcuVagkFfJ56Dliv_FUAG5f95VikZvEATrIZ0mVQNyirPOasWHiqvQ0owrye_g_SCOKI_1ewy0k_M=w600-h450-p'],4 stars,4
Muhammad Saybi,Crossing bridge to the Kumala Tenggarong Island tourist attraction,Local Guide · 29 reviews · 1 photo,6 years ago,[no_minires_images],5 stars,5
Rennyant (RE),"The first time I played here, I failed to move on until now",Local Guide · 164 reviews · 210 photos,8 years ago,[no_minires_images],5 stars,5
beny SM,The design aims to commemorate the first bridge that collapsed....,Local Guide · 38 reviews · 51 photos,8 years ago,[no_minires_images],5 stars,5
Nizam Sadiq,The sensation of enjoying the beauty of the Mahakam River,Local Guide · 267 reviews · 70 photos,Edited 6 years ago,[no_minires_images],5 stars,5
Dika,The toilets are far away and not well maintained,Local Guide · 71 reviews · 16 photos,7 years ago,[no_minires_images],2 stars,2
Rusdi,"The wind is calm, great for relaxing",Local Guide · 7 reviews · 9 photos,7 years ago,[no_minires_images],5 stars,5
dicky sinaga,Iconic but the layout around the bridge is not very neat,Local Guide · 74 reviews · 18 photos,5 years ago,[no_minires_images],4 stars,4
OTWkomandan SMD,Exciting family tourist spot,Local Guide · 5 reviews · 170 photos,5 years ago,[no_minires_images],5 stars,5
Supryrisma,Beautiful bridge at night,6 reviews · 4 photos,10 months ago,[no_minires_images],5 stars,5
Muhammad ARIFIN,Evening snacks with sea food menu at affordable prices,Local Guide · 164 reviews · 87 photos,4 years ago,[no_minires_images],5 stars,5
Laode Asfahyadin Aliddin,"According to recent information, it has been poorly maintained",Local Guide · 88 reviews · 349 photos,5 years ago,[no_minires_images],4 stars,4
Midas Micky,Ruaar Ordinary,8 reviews · 12 photos,5 years ago,['https://lh3.googleusercontent.com/geougc-cs/AB3l90D5fYAeZ4N8AMMQkJw_JM6WKpQHRabWXp7ImDC7idEu3rW8al7tSsKXvIjFLoBDLiBnvkJSSmdHW182n12p0uL4PV0_CsrkRIkF5LI9ZBoy_bTSCZj8MOwyxXYaItQL7koRlf0P=w600-h450-p'],5 stars,5
Arul Ami,It's a fun place to eat,Local Guide · 64 reviews · 266 photos,5 years ago,[no_minires_images],3 stars,3
Abd Halim Amikta,The stairs are high & it's sweltering because the bridge is open,Local Guide · 112 reviews · 54 photos,5 years ago,[no_minires_images],1 star,1
Yahya Ichsan,Great place for tourism,Local Guide · 161 reviews · 351 photos,6 years ago,[no_minires_images],5 stars,5
DPN,It's really a long way to walk across :),"Local Guide · 1,174 reviews · 5,232 photos",8 years ago,[no_minires_images],3 stars,3
Abdul Hakim,Very helpful,1 review,11 months ago,[no_minires_images],5 stars,5
Ridho Ichsan,"Beautiful, strong enough model",Local Guide · 48 reviews · 204 photos,2 years ago,[no_minires_images],5 stars,5
Eno Veater,This iconic place in Tenggarong is a loss if you don't visit it.,Local Guide · 10 reviews · 6 photos,5 years ago,[no_minires_images],3 stars,3
Malika Janitra Priyanto,A good tourist spot in the king's city of Tenggarong,4 reviews,7 years ago,[no_minires_images],5 stars,5
Sugito Medan,Because it's good for entertainment for the whole family..,1 review · 1 photo,7 years ago,[no_minires_images],5 stars,5
Ade Gunawan,The view is good from the top of the bridge.,Local Guide · 79 reviews · 1 photo,Edited 7 years ago,[no_minires_images],4 stars,4
Magfrian Syah,The bridge connecting Tenggarong city to Kumala Island,Local Guide · 166 reviews · 113 photos,8 years ago,[no_minires_images],5 stars,5
Andy Duapitue,Strategic and easy to navigate for long distance compass,1 review,7 years ago,[no_minires_images],4 stars,4
Risdawati Yuliana Simangunsong,10 years ago this Kumala bridge did not exist,Local Guide · 14 reviews · 38 photos,Edited 7 years ago,[no_minires_images],5 stars,5
Richo Pantera,very comfortable place with a very peaceful atmosphere,3 reviews · 2 photos,7 years ago,[no_minires_images],5 stars,5
SARNEDIANTO DIANTO,Very suitable for a vacation with family,4 reviews · 12 photos,5 years ago,[no_minires_images],5 stars,5
SANG_30XC THE OWL XC,Interesting and good tourist spot,3 reviews,4 years ago,[no_minires_images],5 stars,5
rokak gaul,"Nice place, safe and comfortable",Local Guide · 1 review · 5 photos,7 years ago,[no_minires_images],5 stars,5
"Sugeng Subagyo, SH",Hopefully it's stronger than the previous bridge..,Local Guide · 29 reviews · 3 photos,7 years ago,[no_minires_images],5 stars,5
khairinindra indra,Bridge to the Kumala Island tourist attraction,7 reviews · 5 photos,7 years ago,[no_minires_images],5 stars,5
ZanGmanEX,so easy access to the island...,6 reviews · 8 photos,8 years ago,[no_minires_images],5 stars,5
Akhmadhariadi Tenggarong,"OK, great. Monggoooo",Local Guide · 87 reviews · 234 photos,4 years ago,[no_minires_images],4 stars,4
Rico Fitriansyah,A cool place to vacation with family,Local Guide · 4 reviews · 29 photos,6 years ago,[no_minires_images],5 stars,5
anindya lovely vlogs,The place is hot especially when the sun is shining,Local Guide · 57 reviews · 32 photos,8 years ago,[no_minires_images],4 stars,4
Nh Touristiany8,Play here often,Local Guide · 16 reviews · 162 photos,6 months ago,[no_minires_images],5 stars,5
S. Ningsih,I want to go there again. I wasn't satisfied with the tour I went there yesterday.,Local Guide · 45 reviews · 1 photo,7 years ago,[no_minires_images],5 stars,5
Mardianus Up,Very busy but romantic in the afternoon,Local Guide · 27 reviews · 29 photos,7 years ago,[no_minires_images],5 stars,5
Hendri Yiq,A very comfortable tourist city,1 review · 2 photos,6 years ago,[no_minires_images],2 stars,2
Dedi Costacurta,"Bridge to Kumala Island, a tourist attraction in Tenggarong City.",Local Guide · 21 reviews · 361 photos,6 years ago,[no_minires_images],5 stars,5
Norssca Wuisang,In 2006 the Repo-Repo Bridge had not been built.,Local Guide · 44 reviews · 519 photos,3 years ago,[no_minires_images],5 stars,5
Octavira Karina,The view is just nice,Local Guide · 26 reviews · 17 photos,6 years ago,[no_minires_images],4 stars,4
Tony_ Marbun,This place is very nice Tenggarong Kutai Karta Negara,Local Guide · 33 reviews · 9 photos,5 years ago,[no_minires_images],5 stars,5
Fahni Haris,"Not kesana, not ada festival erau",Local Guide · 192 reviews · 313 photos,6 years ago,['https://lh3.googleusercontent.com/geougc-cs/AB3l90CeBg0UEM42SHXyxAxQZOkAV3RM_zd-AGM9OEGn0WmiKPXZd39rvQXb1d9mTi7OCvAQj2WCnbBTrKguc68FM0wZM9cwb6qt-a5JzqL3nKDQG2tQrd5da_acyTqfvyPT9P1TZTfzNA=w600-h450-p'],5 stars,5
Fuad,Hot.,Local Guide · 131 reviews · 219 photos,6 years ago,['https://lh3.googleusercontent.com/geougc-cs/AB3l90BrW6_Wn3lyK3N_uA_gCkc4PwUtRsZ8UjWteKRjJes0kLcEa5_I4X7Qsmd-2qvcPxXVJ8TjUb0PE2rf8vfqZ23-xfNPa6b4CUmCQKi1SPaBEcTyCoryCa-TwwBoiiV4DM0wKsM2=w600-h450-p'],4 stars,4
Zeto Penzom,Good for walking exercise,Local Guide · 67 reviews · 24 photos,Edited 7 years ago,[no_minires_images],5 stars,5
Eka Prambudi,Fun children's play area,Local Guide · 19 reviews · 8 photos,6 years ago,[no_minires_images],5 stars,5
Toni Setyawan,Special bridge crossing to Kumala Tenggarong Island,1 review,2 years ago,[no_minires_images],4 stars,4
Luberta Agung Amartya,"Cool, looks classic but has an unusual history",Local Guide · 113 reviews · 112 photos,5 years ago,[no_minires_images],5 stars,5
yoko trianto,"I miss taking selfies on the Repo2 bridge, when is it open?",Local Guide · 68 reviews · 14 photos,2 years ago,[no_minires_images],4 stars,4
Eric Dwi Septian,"place to go to Kumala Island tourism, Tenggarong","Local Guide · 256 reviews · 1,155 photos",5 years ago,[no_minires_images],5 stars,5
abi dardha,tourist destinations that must be visited,7 reviews · 4 photos,7 years ago,[no_minires_images],5 stars,5
Ttriz91,"Pick up your bike, cross the island, go around Kumala Island until you're satisfied",Local Guide · 22 reviews · 11 photos,5 years ago,[no_minires_images],5 stars,5
putu kusuma dewi,Not bad if you walk...jos,Local Guide · 24 reviews · 2 photos,6 years ago,[no_minires_images],5 stars,5
Tyas Fuera,Repainting has started.,74 reviews · 11 photos,2 years ago,[no_minires_images],4 stars,4
Dewa Arinda,"If you go to Tenggarong, you must come here to immortalize your visit",Local Guide · 142 reviews · 42 photos,6 years ago,[no_minires_images],4 stars,4
Dzaki rudiansyah dzaki,"Enjoy walking here, the views are very beautiful",Local Guide · 5 reviews · 65 photos,7 years ago,['https://lh3.googleusercontent.com/geougc-cs/AB3l90DAAsb4sNuZ3ziCYE4jB6GaOG8TVPdchW9bSL-OYPJIw4kxZAmeLFuwGmdXcrTGNiW4TF6MbeA4wo1NC4-aeHh41Ywtv2bnLJW5P-HAQzzWDcw0ZSISyEKRRJx0FCA7aQN8-Oo=w600-h450-p'],5 stars,5
nanang sarkani,"Kumala Island tourist spot, in Kutai Kartanegara district",1 review,7 years ago,[no_minires_images],5 stars,5
Yusuf Affandi,"Yes, it's really fun, it feels like being in Hamburg, it's fresh",Local Guide · 336 reviews · 358 photos,2 years ago,[no_minires_images],5 stars,5
Bece mukhlis,A beautiful bridge to get to Kumala Island,Local Guide · 20 reviews · 15 photos,6 years ago,[no_minires_images],5 stars,5
adi Samijo,This is one of the areas prone to traffic jams,Local Guide · 77 reviews · 5 photos,2 years ago,[no_minires_images],3 stars,3
Suzy,Haven't crossed yet because it's closed😁 …,Local Guide · 26 reviews · 3 photos,2 years ago,[no_minires_images],5 stars,5
Bank Cum Channel,Almost a bridge of love. Lots of love locks,Local Guide · 10 reviews · 13 photos,6 years ago,[no_minires_images],5 stars,5
darma wasa,It's cool... the bridge connecting to the Kumala island tourist attraction,Local Guide · 89 reviews · 61 photos,7 years ago,[no_minires_images],5 stars,5
Mufah Islamy,"A bit hot, viewers 😁 …",Local Guide · 43 reviews · 249 photos,6 years ago,['https://lh3.googleusercontent.com/geougc-cs/AB3l90DReuWEcWcBOmss0IUO3RWE_yqYGst_U0VRrJfEeWlbWjzsg_gpwdk2GBrRf8M-cnE5I_JS7ZoHs_maEemuCfrWfpKUBpuqclW96HlLuRoh0IqLXtz8lUya7k_dgfsq6htAjPo6oQ=w600-h450-p'],4 stars,4
Rudi Hamli,The connecting bridge between the city of Tenggarong and the tourist attraction of Kumala Island..,Local Guide · 195 reviews · 47 photos,Edited 2 years ago,[no_minires_images],3 stars,3
Suwoko Tya Wicaksono,A comfortable island for vacationing with family,2 reviews · 7 photos,7 years ago,[no_minires_images],4 stars,4
Sarli Miqdad,This is a cool bridge connecting to Kumala Island,Local Guide · 107 reviews · 2 photos,Edited 7 years ago,[no_minires_images],5 stars,5
yuniati suroso,So it's closer to Samarinda Seberang,Local Guide · 85 reviews · 135 photos,7 years ago,[no_minires_images],5 stars,5
Mu yousuf,"Cool and peaceful on the island of Kumala, Kutai Kartanegara",Local Guide · 40 reviews · 85 photos,7 years ago,[no_minires_images],5 stars,5
Bang Ajay channel,One of the good tourist attractions in Tenggarong,Local Guide · 54 reviews · 34 photos,5 years ago,[no_minires_images],4 stars,4
Yazid Ripani,Beautiful,2 reviews · 5 photos,2 years ago,['https://lh3.googleusercontent.com/geougc-cs/AB3l90Acrf21lxUCFEvqcCSfXIu5Mun2VlojLllPZbF_9fYw7VjF8U6qjzN_WKgTI4luNEUVOKCN6MZiTskdbEM0yJpp28AJWArNeOixmmWMSBYf3xrfAyS7gvd1ebhQGlRatuTEYAM=w600-h450-p'],5 stars,5
Yanuar Ari 2013250061,"The bridge is long, it is recommended to take a bicycle there",4 reviews,6 years ago,[no_minires_images],4 stars,4
Hari Supranoto,Making it easier for people to travel on Kumala Island...,Local Guide · 70 reviews · 65 photos,8 years ago,[no_minires_images],4 stars,4
Hartono Halim,Good for recreation,1 review,6 years ago,[no_minires_images],5 stars,5
Agus Leo CHANNEL,Great view from the top of the bridge,Local Guide · 34 reviews · 89 photos,Edited 4 years ago,"['https://lh3.googleusercontent.com/geougc-cs/AB3l90B-2iQv1rBNrXIzCgttf2ckm6OJc3FAWL9tk59Vit7r3Cgn1AtvcMnT2olFdpDXtGx-AYxlAu4qzF9_gVbasEdwFfdW70wAd04dutn3XuE3AeIbq55g2DVWzFw-TqwcxzOjouzZJA=w300-h450-p', 'https://lh3.googleusercontent.com/geougc-cs/AB3l90B9NMHmB0Jmw76vRhDBbJ_OX_9VlPxLENcIfas_G00JAh-2lPiQ06nQ92MqQg0vqXKsHRaykpEzsWrjAdGf4JconEXc67QMqMjRsRDlmCV3tXS3U4NjlXpkZRnayHgEmNVLeeOU=w300-h450-p']",5 stars,5
Winda Unika,"The bridge that connects tourists to Kumala Island,",Local Guide · 24 reviews · 6 photos,6 years ago,[no_minires_images],4 stars,4
Najwa Nabila,You must visit this beautiful and exciting place,4 reviews,7 years ago,[no_minires_images],5 stars,5
tajong carek,Access to Kumala Island tourism,Local Guide · 5 reviews · 5 photos,8 years ago,[no_minires_images],5 stars,5
Sri Minarni,Purchase tickets after crossing the bridge,Local Guide · 82 reviews · 72 photos,6 years ago,[no_minires_images],5 stars,5
Junita Hutapea,The view is very nice,Local Guide · 20 reviews · 3 photos,6 years ago,[no_minires_images],5 stars,5
Ahmad Rofi,Very helpful for crossing Tenggarong-Samarinda,2 reviews · 1 photo,8 years ago,[no_minires_images],5 stars,5
idnnoona,A beautiful bridge connecting Tenggarong to Kumala Island,Local Guide · 23 reviews · 3 photos,7 years ago,[no_minires_images],4 stars,4
Ummu Kalsum,[no_review],Local Guide · 7 reviews · 34 photos,5 years ago,"['https://lh3.googleusercontent.com/geougc-cs/AB3l90BIpp6uN5Y3TzcTKTUYQojuDgxsCS560Wxkd8id0RjTO8v1H2DK3finWwaY6WGoQ5KYe6JU6tgtHR1gnwq6lXDGVK9waR_GKCUg5QKCIuSwZUsP1bEbuWkXdxUIiQqxFs_gBHPS=w300-h225-p', 'https://lh3.googleusercontent.com/geougc-cs/AB3l90AJNitNVkvPSCU-hGz4Wlb2hXf0b840AxJbga0EYnH2-TY88kfCxsnLWMlEU3BzNnC7ugoRNg4fAZxqXr9BMUZmvYLGQzR4M4j4kKNZFUhtbnzUeT3UQORqw1HYkMtoTByNN98=w300-h225-p', 'https://lh3.googleusercontent.com/geougc-cs/AB3l90CaK8SBPmwRPaQ3txOTtN2r2hDRb4uUDbUaC5aeucZEalnkIQAIfp3389W_iXZzvy0tjmYy7B8Dg4jkjNzdc6_idHJl-Apy2ghzvYzvFGJbMr9TQIYvf2Ia2W34aPO-82rme-7jkw=w300-h225-p', 'https://lh3.googleusercontent.com/geougc-cs/AB3l90DVNlscE9naR6ulDGNhoo1DlVl5NQ-xOdqun5yjFAuTiqiZHNbf0Fi33uRFHwmKyWonPOl7nzYth3lDNQeikLiDShhslh3av2vL7xM3ppwILy45_xqN27-AbSeRZ3LpNPAXVAU=w300-h225-p']",4 stars,4
Bagas Abrarian Primananda,"Cool, there is a yellow bridge👌 …",Local Guide · 66 reviews · 19 photos,7 years ago,[no_minires_images],4 stars,4
moedhy wisnu,Special lane for pedestrians,Local Guide · 47 reviews · 31 photos,2 years ago,[no_minires_images],5 stars,5
Zachary alimuddin Zahid,good for family recreation,Local Guide · 60 reviews · 96 photos,7 years ago,[no_minires_images],3 stars,3
Catur Bunga Febriati,Very good especially at sunset,Local Guide · 162 reviews · 8 photos,5 years ago,[no_minires_images],5 stars,5
Mario 95,Because Jembayan is an unspoiled village,2 reviews · 8 photos,7 years ago,[no_minires_images],3 stars,3
Johan Firmansyah,"Yes, this is a nice place for two people.",Local Guide · 36 reviews · 25 photos,5 years ago,['https://lh3.googleusercontent.com/geougc-cs/AB3l90DLzwvwYuzevi3fIM0jBVxJ1wPih5DsETHaJMhYUroSogi9HOiP-WjddTua28c89kU-aOuvT2AVLybRR8jr2aNzdOPLDokVS3kjcVtTb8LaghdQjomRV3lFaQyuto23MzRJBAY=w600-h450-p'],5 stars,5
Meni Wati,Very interesting,1 review · 7 photos,2 years ago,[no_minires_images],5 stars,5
Yazid Syukri,absorbed,Local Guide · 36 reviews · 47 photos,5 years ago,['https://lh3.googleusercontent.com/geougc-cs/AB3l90BmXeHwuPBJdoTAXh2MGH07wbSJolA4g03BQD9BFny6MUPA6zpoThiQZcq6BE4IQxysaZw05eI7zEjtjUh9eV4aMcf5whSGbPzn_T8NkIM8alPowpfQ12gPqHoqLXbu_IHtQFPlVA=w600-h450-p'],4 stars,4
Tria Triana,Take a relaxing walk to Kumala Island...,Local Guide · 30 reviews · 7 photos,7 years ago,[no_minires_images],5 stars,5
mulia em,"The new bridge is beautiful, it could be a selfie location",Local Guide · 156 reviews · 10 photos,6 years ago,[no_minires_images],4 stars,4
Sopia Norti,Kumala Island Bridge for crossing to the Kumala Island tourist attraction,4 reviews · 1 photo,8 years ago,[no_minires_images],5 stars,5
Aan fakih hidayat,Aahh. . .I'm cute. .I like you. . .,1 review,5 years ago,[no_minires_images],5 stars,5
RRN WOOD ART,Unique ... because it only exists in the district. Kukar,6 reviews · 7 photos,6 years ago,[no_minires_images],5 stars,5
Anita Oktaviana,[no_review],Local Guide · 3 reviews · 438 photos,Edited 2 years ago,"['https://lh3.googleusercontent.com/geougc-cs/AB3l90BEO34xOWKe3DItXD1WcXbcdHFP5LiOUEFRmqfDenhCFGAgwjMKow5b4WK_R7ZXSzYuaFqeJ1N8wcOdbMHY1qYhOa69TxJ7DICk44Hd1sOdKUeD0su06dfkWleHqBH7KlgpGrpUtg=w300-h225-p', 'https://lh3.googleusercontent.com/geougc-cs/AB3l90CjdE-urxMCQstajUnZAnFSd3fZbJsrMXe5JcwyISrcQOcVOysENQT1SNE2PFvwtavduYftlilCn4jmYyPCBsMALPSuklGti0C7Cs_sMcX_i1NuXxc5uxeZVCjH8SIgDs8uYZo=w300-h225-p', 'https://lh3.googleusercontent.com/geougc-cs/AB3l90Bz5JLWIuUykv7-KWgiNAKjb_HstfQZI6DhAGIFbCFkCKNBChtR1uSaQsyHE-S8KY6xFa-UGDrv_7bH0P64dUd83bHbiVYVn73trPhqGGSjGDmmNqus8gtXKWtMsNnql77LpCnM=w300-h225-p', 'https://lh3.googleusercontent.com/geougc-cs/AB3l90BN0mwAAscVaojN-VBX97NIBzgXf_lkJzMX4D8ZViKdFM8q4t5VnitjWUQyqPQU2LI5nyzImCuh5K0hInsoakL7W-rDxCk7J6D8A2firB2jPHg98QbLeVsADpcIZqikfeS6oJoM=w300-h225-p']",4 stars,4
Naseh Udin,"Pulo last night added here, instead added there,",5 reviews · 14 photos,2 years ago,[no_minires_images],4 stars,4
Daily Story Mustari,Take a walk with your children across the Tenggarong Repo Bridge,Local Guide · 8 reviews · 152 photos,6 years ago,[no_minires_images],5 stars,5
Abdul Syukur,Very good,13 reviews · 26 photos,a year ago,[no_minires_images],5 stars,5
rahmadi madi,Not well maintained,18 reviews · 1 photo,5 years ago,[no_minires_images],3 stars,3
Anggi febrianto,Very cool new bridge,Local Guide · 166 reviews · 349 photos,7 years ago,[no_minires_images],5 stars,5
Arsad Arsad,Comfortable picnic place,Local Guide · 105 reviews · 14 photos,3 years ago,[no_minires_images],5 stars,5
Septian Pratama,"Nice, the bridge is clean",Local Guide · 67 reviews,3 years ago,[no_minires_images],5 stars,5
saipul lah,it's a good tourist spot,1 review,Edited 5 years ago,[no_minires_images],5 stars,5
Devi Hindaryanti,Tenggarong has a unique bridge,Local Guide · 81 reviews · 8 photos,6 years ago,[no_minires_images],5 stars,5
RA MULYADI,Recreation facilities with family,Local Guide · 48 reviews · 39 photos,6 years ago,[no_minires_images],5 stars,5
ANDI FAIZAL ANDI MUIN,[no_review],Local Guide · 63 reviews · 531 photos,6 years ago,[no_minires_images],5 stars,5
Amin Muhammad,Not bad as a tourist attraction in Tenggarong,2 reviews,6 years ago,[no_minires_images],5 stars,5
Ardi Sumardi,A cheap tourist destination in the city of Tenggarong,Local Guide · 105 reviews · 29 photos,7 years ago,[no_minires_images],5 stars,5
Arif Santoso,The bridge's concrete has many cracks and holes too,Local Guide · 88 reviews · 77 photos,5 years ago,[no_minires_images],2 stars,2
Ahmad Arief Ahyani,"The counter is strange, don't like the counter part",166 reviews · 686 photos,6 years ago,[no_minires_images],4 stars,4
Kiko Chanel,Iconic bridge in Kukar,"Local Guide · 492 reviews · 1,431 photos",a year ago,['https://lh3.googleusercontent.com/geougc-cs/AB3l90Ch5kR440uDWR7oWIR6cV7OjoLlDjSbXZbjJUmPgBYZOlxObAMU50hMRFlg-UN-IuoNsqSwBCCD1u-bBx-PdCJrFtA3n6wwFGuFuU1btZfCyxdq-e2dnQdvBbPMJkLODm6ruGVl=w600-h450-p'],4 stars,4
Fitri Kardila,There's no light at night,Local Guide · 94 reviews · 37 photos,6 years ago,[no_minires_images],3 stars,3
Akhmad Fahrozi,If you give it a roof it will be even more awesome....,8 reviews,5 years ago,[no_minires_images],3 stars,3
