name,review,contrib,humanized_timestamp,minires_images,stars.label,stars.value
Fachri Syamdoni,What a great bridge,Local Guide · 32 reviews · 208 photos,4 years ago,"['https://lh3.googleusercontent.com/geougc-cs/AB3l90A5gQKRuxxE4qMpNN03QkSCRy-EOzTvURfT_UTv5wOWIzc5YlikwYJRtH-pKNDJCE8xe8lVn-NSQq0cGgHyfiasLkz-izZysAoxd7T3oWucA8_6jnWXSdNUhF2DZ12tonPkhrbg=w300-h225-p', 'https://lh3.googleusercontent.com/geougc-cs/AB3l90D9d8SIwJJD6dgfY0Rj4O6qR_cf6AnP4aTLs2D9jewk38Z6gFJY6-iH2nzovek3Cc7iHmJfcgm_72V3sv3lV_XDuTXe7oM9QlPqhc9xADYMbVccmCUz54HZVGgQtHeoenGJ-du-=w300-h225-p', 'https://lh3.googleusercontent.com/geougc-cs/AB3l90BsfTmM0O29OReQiipl3qe2XgQpzhWbkVcWB8ZRNtCOXLdHhnRhjA_smrUk9pzgDWABtfYql7jEOfZ4d8nTMUiE8yvAL8bhBygr4J4OVnNVclPOk04bOtUXPQCX8zcfMMUK-W6J=w300-h225-p', 'https://lh3.googleusercontent.com/geougc-cs/AB3l90DLa3HFTZj2kfquf-63hnnsMvSOyZVj4DHauNg_xSu-93V5Ozp8833q834O7A836u2iPzKFCUJBfYMntVY3qnuvXTytWwcNRyfhskwgPs00SC8xaSftmixC1HGgqYhj80ZkpXjhkg=w300-h225-p']",5 stars,5
Jumaditya Ady,"Exciting... Cool and peaceful on Kumala Island, lots of souvenirs are also sold, you can learn history, there are lots of toys, it's really fun to go on holiday with family and friends.",6 reviews · 5 photos,6 years ago,[no_minires_images],5 stars,5
Yulius Faizal,"The bridge is good, you can see the river clearly, but I'm afraid the Mahakam River is wide too, Tenggarong is a comfortable, safe and peaceful city, OK, the city",Local Guide · 117 reviews · 23 photos,6 years ago,[no_minires_images],5 stars,5
Busri sh,"Repo Repo Bridge, Kutai Kartanegara, East Kalimantan Province is the access to Kumala Island, a family tourist spot that is a must-visit. Come visit Kumala Island.",Local Guide · 2 reviews · 59 photos,Edited 7 years ago,[no_minires_images],5 stars,5
Made Urip R.,A special pedestrian bridge that connects Tenggarong city and Kumala Island... motorbikes or bicycles are not allowed to pass...,Local Guide · 59 reviews · 23 photos,7 years ago,[no_minires_images],5 stars,5
must Joko Mulyono,The bridge connecting to Kumala Island... can make a photo spot over the Mahakam river....,Local Guide · 278 reviews · 768 photos,a year ago,[no_minires_images],5 stars,5
Zulkifli Dunggio,Good enough for a weekend getaway. It would be good to provide car access to get to the island,Local Guide · 16 reviews,3 years ago,[no_minires_images],3 stars,3
Zulfiqar Hafid,"It's a very good idea to make a pedestrian bridge on foot, so you can enjoy a good view of the river",Local Guide · 87 reviews · 7 photos,6 years ago,[no_minires_images],4 stars,4
Uus Inspiration,"If you walk, it's not bad, if you come here you have to rent a vehicle because the location is like a forest, there are lots of prehistoric remains",Local Guide · 43 reviews · 79 photos,Edited 6 years ago,[no_minires_images],3 stars,3
Dony Apriyudha,Very satisfied,Local Guide · 33 reviews,4 weeks ago,[no_minires_images],5 stars,5
Naomi Rarukan,"The bridge is nice, there are lots of padlocks on the edge for those who want to make Korean-style dramas, it's suitable there, the atmosphere is also ok, the afternoon is really hot",Local Guide · 246 reviews · 22 photos,6 years ago,[no_minires_images],5 stars,5
Kurnia Darmawan,There are lots of trees so the atmosphere is also cool. The location is quite clean and well maintained. Unfortunately the place to eat is still not well organized.,Local Guide · 208 reviews · 53 photos,7 years ago,[no_minires_images],3 stars,3
Lastthree Cute,The yellow bridge is hung with lots of love locks🔒♥️ …,Local Guide · 9 reviews · 14 photos,5 years ago,['https://lh3.googleusercontent.com/geougc-cs/AB3l90BQwPWHazzLXDksFbr7zCPHrzbJeQTiyuZSQBOOjvev7Gbdvd-0Cf32OrXNUHUTLx_uYRetjWYl7G5ttaoOM07m1uhT88DFkZE8yJTzx-aRKcU0KZUqlsk2Bywle2stCVAPU3hHig=w600-h450-p'],5 stars,5
adie bagas,Beautiful atmosphere while pedaling a bicycle that is rented on Kumala Tenggarong Island... great for relaxing and chatting with the family,Local Guide · 52 reviews · 2 photos,6 years ago,[no_minires_images],3 stars,3
Abdul Galib,"Please ensure that the water in the mosque continues to flow, so that we visitors can perform whudu. Thank you in advance",1 review · 1 photo,6 years ago,[no_minires_images],2 stars,2
Norma Baena,"Cross the long bridge using your feet, if you want to go to the big statue you can use your feet but it's far so you have to rent a bicycle/motorbike",Local Guide · 43 reviews · 125 photos,6 years ago,[no_minires_images],4 stars,4
Indra Rahmad 182,"This place is clean and good for photo spots, the view is very beautiful, especially at dusk we can see the sunset",8 reviews · 2 photos,5 years ago,[no_minires_images],5 stars,5
syafira indah,It's really cool to really want to take photos here hahaha,Local Guide · 50 reviews · 21 photos,5 years ago,['https://lh3.googleusercontent.com/geougc-cs/AB3l90C6tL37GhdKLu4BcslMYb0zqA2vV0iRXR2TpR3RGN15QuDW7RJXBZO7wgcXCMqfECld8ZXYafS4X73EcA1sH6PzVb-IY39QAutiCc8zMeM6bDqM0T0P_NEJ47KnC1kx8fmTfb3zkQ=w600-h450-p'],5 stars,5
Agus Riady,It's quite tiring because the bridge is quite long and there is no place for wheelchair users.,Local Guide · 93 reviews · 9 photos,6 years ago,[no_minires_images],3 stars,3
Veliyana L.A,"The island is well managed but it would be even better if several spots were maintained, cleaned and functioned to attract interest",Local Guide · 106 reviews · 6 photos,8 years ago,[no_minires_images],4 stars,4
fenny octavia,"""The place is really good for sports/just walking,"" but it's a shame that the location is not well maintained, a lot of it is neglected",Local Guide · 12 reviews · 6 photos,5 years ago,[no_minires_images],4 stars,4
Wafiq Azizah,"*Very nice bridge
*The view on the bridge is also beautiful because it is located above the Mahakam River
*There are also love locks hanging along the bridge",Local Guide · 6 reviews · 15 photos,7 years ago,[no_minires_images],5 stars,5
Aries Gunawan,One alternative interesting family tourist spot. There are electric motorbike rentals to go around the island from end to end,Local Guide · 101 reviews · 33 photos,7 years ago,[no_minires_images],5 stars,5
Hana Permata,"If the bridge lights are dark at night, it looks dirty, try adding decorative lights so that the view at night is good",Local Guide · 9 reviews · 2 photos,7 years ago,[no_minires_images],2 stars,2
Muhammad Arif Rahman,Entertainment Suitable for children,Local Guide · 178 reviews · 371 photos,7 years ago,"['https://lh3.googleusercontent.com/geougc-cs/AB3l90BKkXW9tX_Hog82f4R1oxe_dnAfEgvj_fhIuorAT-D25YSCGOi1Y7ieMdY-OFUCe2seCPUUOAIyU_Qft7QrY52rpw-i7zc3k9YCcEpd-UTOrCSEAnWS1KRgfdyXefjeMs4xsN7L=w300-h450-p', 'https://lh3.googleusercontent.com/geougc-cs/AB3l90AKlm5dhoPbaBKMIxVGcLkY4vGJEtlSSIezm7N7JuI9KFkoY4WdRZrDedsGPKsgDq9HZHqK8IQ2zZeHRoaw8AyKB41_tEWveW42fj1CjfB4wENYpKmFQoPQ0vSIYvF9f-2_sfDX=w300-h225-p', 'https://lh3.googleusercontent.com/geougc-cs/AB3l90Clv-8vgbSLDZkxxnv_mIDh7nZIN_2NT7nxgPl6ZF7T0drQ_N7K21QaOoIuqVcx_f0xdCH1zvyWGe_6gz03A9w0Nz45mI1BsfbSAoTr9jC9V7divV7ak5gIzarFtW7z4RqJuDCIEw=w300-h225-p']",5 stars,5
Farra Aulia,"Visited Kumala Island for the first time in 2007, and still by crossing via boat. Now it's much different, more efficient with bridges.",Local Guide · 102 reviews · 356 photos,8 years ago,[no_minires_images],4 stars,4
khamsi fadillah,"For those who like nature and history, if you go to Kutai it would be a loss if you don't come here. A beautiful place with lots of trees and several buildings typical of the Kalimantan region🍂 …",8 reviews,5 years ago,[no_minires_images],5 stars,5
Renata Munthe,So it's easier to cross to Kumala Island,Local Guide · 72 reviews · 56 photos,Edited 6 years ago,['https://lh3.googleusercontent.com/geougc-cs/AB3l90B0ECNGb8ohWFZC0AUw5sy9mOHE8XIIYAlPXvW52RMXbtNRW6FmqpE3AetnWB-Jh3onFdMECPAFVqXqkdXJSEi1wWbzFUJ9DbtchinfvNnVxqvFQcQ4NlOQZrLSjUuFynB4ev3C=w600-h450-p'],5 stars,5
Fia Agustina Tokare,"The staff are friendly, always smiling and the food is all delicious",10 reviews · 5 photos,a year ago,[no_minires_images],5 stars,5
Yanwar Satriawan,"That's great, but there are those who regret that the historical heritage of traditional houses has not been maintained, please ask the parties concerned to preserve it",Local Guide · 15 reviews,5 years ago,[no_minires_images],5 stars,5
Budiono Eko Prasetyo,"The place is actually fun, but it hasn't been managed optimally. It's very hot and it's too expensive to play games inside.",Local Guide · 104 reviews · 425 photos,7 years ago,[no_minires_images],3 stars,3
Abdurrahman AR,Must come here on the weekend! So it's not scary Hhaha,Local Guide · 22 reviews · 128 photos,8 years ago,['https://lh3.googleusercontent.com/geougc-cs/AB3l90B2dHcFGmZ_Vng6YABZRW_hJSfKe0gqKx8UO_9PXsirdIAonMY8R_z8FqjIjSYdpuXeg-qPLTTfPBOiqA45YVfUh7Fr8TdJ-MJFs8nqXEw0t9HzZyItaPAuly5PXn7eCg7l7UCr=w600-h450-p'],5 stars,5
Riobie McShamroog,"It was still free at first, but if I'm not mistaken now it's paid, the bridge that connects Kumala Island and the main island","Local Guide · 876 reviews · 3,204 photos",6 years ago,[no_minires_images],4 stars,4
PATRIA Ershi,"It makes it easier for visitors to get to the Kumala Island tourist spot, but unfortunately there are no facilities or access for disabled visitors",Local Guide · 88 reviews · 47 photos,8 years ago,[no_minires_images],3 stars,3
Andi Ramadhan,"Please pay more attention to the maintenance of tourist areas, it would be a shame if it just became a place that isn't looked after like that",2 reviews,5 years ago,[no_minires_images],5 stars,5
bam sus,"The bridge to Kumala Island is over the Mahakam River... but unfortunately it's hot during the day, you have to bring an umbrella.",Local Guide · 90 reviews · 76 photos,6 years ago,[no_minires_images],4 stars,4
Setiati Prasetyo,"The inspiration for this bridge is like in Paris, namely that we can write our name and our partner's name on the padlock and lock it on the bridge railing so it is also known as the ""Bridge of Love""",Local Guide · 14 reviews · 650 photos,7 years ago,[no_minires_images],5 stars,5
Riza Al Muttaqin,"You could also say it's a bridge of love because this bridge has empty space to place padlocks for you and your partner, like bridges in Korea.",Local Guide · 39 reviews · 3 photos,8 years ago,[no_minires_images],4 stars,4
Endah Pwt,"It's really beautiful...especially from a distance, it's very nice, the place is clean, comfortable...foam while looking at Kumala Island",58 reviews,5 years ago,[no_minires_images],4 stars,4
Muhammad Hasan_ Official,It's nice to sit and relax with Doi while looking at the view of the bridge lights at night. Hehehe,Local Guide · 60 reviews · 16 photos,Edited 3 years ago,['https://lh3.googleusercontent.com/geougc-cs/AB3l90B-U7dvTSjeiW_oBOlChGEOugtiU43YxNJ8FxIfCX-QpF0fRMIxvAC6V3bt7srBkIyYPHxnp21s539pEs4Tv89AJq3-Z3JkeVVsR12grsSvuR4q0kGszcObxmaKiroaQmLnCZA0=w600-h450-p'],5 stars,5
M. R Imam Subarkah,A place to relax at night while enjoying culinary. There are 'Salad Asiik Tenggarong' and 'Teh Boba' which have just opened and are on discount,Local Guide · 11 reviews · 1 photo,5 years ago,[no_minires_images],4 stars,4
Husay Say,👍 …,2 reviews,4 months ago,[no_minires_images],4 stars,4
FISHER REINSTEIN,"Repo-Repo Bridge, a bridge connecting Jln. K.H Akhmad Muksin & Kumala Island.

This bridge is the best spot for taking pictures.. this bridge was also made to commemorate the Kutai Kartanegara Bridge that collapsed in 2011.",Local Guide · 48 reviews · 57 photos,6 years ago,[no_minires_images],5 stars,5
syarifah “Yuyun Habsyi” khairunissa,"Please add roads that are friendly for parents, because when I took my mother there she couldn't climb the stairs...",Local Guide · 21 reviews · 17 photos,6 years ago,[no_minires_images],3 stars,3
Tya Tarigan,"Tourist attractions suitable for families, affordable, unfortunately many of the rides are no longer running",Local Guide · 204 reviews · 249 photos,7 years ago,['https://lh3.googleusercontent.com/geougc-cs/AB3l90AK3_zW6QCofe2EDrAPXc8UbxYa-byZMLfhM_IhMwEl0aikiHt18qLcZTvedWsZVBGROvGS9Kuw7sbg_8O__5_AYLcdqxXmHM-8x15VszpRX-zy5XS1MZhV3PyNa4_Bcbvsd_rUgg=w600-h450-p'],4 stars,4
Arip Setia Budi,"The place is beautiful, suitable for taking memorable photos with family, life partners, and also suitable for morning and evening exercise.",4 reviews,5 years ago,[no_minires_images],5 stars,5
Yuliyanti,"The place is clean, well maintained. The garden is nice plus there is a conta padlock which makes it unique",Local Guide · 14 reviews · 6 photos,7 years ago,[no_minires_images],5 stars,5
Dedy Setiawan,"A visit to the city of Tenggarong would be incomplete if you didn't visit Kumala Island, with its distinctive Repo-Repo bridge which has become a tourist icon.",Local Guide · 66 reviews · 21 photos,6 years ago,[no_minires_images],5 stars,5
Irianta Jo,"Not well maintained, many facilities are not functioning. Visitors are relatively few","Local Guide · 488 reviews · 2,018 photos",6 years ago,[no_minires_images],3 stars,3
eri topik gunawan,A comfortable place to hang out in the afternoon,Local Guide · 118 reviews · 15 photos,7 years ago,['https://lh3.googleusercontent.com/geougc-cs/AB3l90AIArOr_fU7FCi0LP4ncfxbsMbQluO1k0VrgtYNQoth00DeVvKGnCyrvG6PgcmmaYqqh55MgSwrronfsA5i86alcqzHpBMDPGLYyhhv8dDSBPI_E9ASsj4uPtEFAnBzzEyaOw0o=w600-h450-p'],4 stars,4
Ronin 999,"Good, unfortunately not too well maintained",Local Guide · 15 reviews · 209 photos,5 years ago,['https://lh3.googleusercontent.com/geougc-cs/AB3l90Bw-C03TLr3PKw2W4b6uHl-iFZCI_bzbOQvgfGGpwHqFjj-7or3-YidM840dXB15EgQ4nuLh_MnfVWLNsEaS-fCXKdwWJiSGsEhLlXdd2jiwJ36wStnVEBN6GnDC1t2Y_A00tXJ=w600-h450-p'],5 stars,5
Sandi Kelana,I hope that young people will be rich again when the cable car will be functional again and the other facilities will also be like the sky tower too,1 review · 3 photos,Edited 8 years ago,[no_minires_images],4 stars,4
Joyo Londo,"The Kukar repo-repo bridge provides access to the Kumala island tourist spot, the atmosphere is good, dividing the Mahakam river.",Local Guide · 3 reviews · 18 photos,Edited 5 years ago,[no_minires_images],5 stars,5
Ragil yoga pamungkas,"The right place for a holiday during the fog, the place is spacious and you can jog at the same time hahaha.",Local Guide · 14 reviews · 15 photos,5 years ago,[no_minires_images],5 stars,5
H. Panca Ramadhani . doni,"We are the first travel pioneers in Tenggarong, Kutai Kartanegara. And up to now, with tight competition... thank God, consumers still trust us to serve you.",4 reviews · 10 photos,6 years ago,[no_minires_images],5 stars,5
Badi M,"A cool place to explore together, either on foot or with various rental vehicles (bikes, scooters, hoverboards)",Local Guide · 16 reviews · 187 photos,7 years ago,[no_minires_images],4 stars,4
Svradji Hermadji,Ample parking is convenient in the afternoon,Local Guide · 7 reviews · 19 photos,9 months ago,[no_minires_images],5 stars,5
Tere,Tiring but enjoyable trip,Local Guide · 108 reviews · 367 photos,Edited 4 years ago,"['https://lh3.googleusercontent.com/geougc-cs/AB3l90APoKriElICHxcyYK_gk4zRfQLJaJlFqC-jfFw6NDLRB-_urm5lSqEQuDLetz3RXKZG5EzM4aTBQgSt7EaK3unNonsBWYPDzXx9DDioECFN57_dIP1Sl_dt9wkYU-TfMN8UnPQT=w300-h450-p', 'https://lh3.googleusercontent.com/geougc-cs/AB3l90C706jqBTW3EZ2eCIr_lTn0OeXg1Te4eCZkmTAx0tuBUJ1ljQ-7RxKHDtzqluGgqF4dgXPPjqtNXHhjOFaCaIznj6_I4gSZyVLfyoJS4LONy9Wq5ZZq3ceDeU_Aqv03d3NJI9DBJw=w300-h450-p']",5 stars,5
Tuyung,The new bridge was built in KUKAR to facilitate holiday access for local and foreign tourists.,Local Guide · 25 reviews · 18 photos,Edited 6 years ago,[no_minires_images],5 stars,5
Eza Daresta,"A fairly long bridge to walk across, but it's all paid off with beautiful views.",Local Guide · 157 reviews · 326 photos,7 years ago,[no_minires_images],5 stars,5
alifa chennel,"I like the atmosphere, I've been here many times
In the morning the air is fresh and the sun is warm😃😄 …",Local Guide · 18 reviews · 3 photos,7 years ago,[no_minires_images],5 stars,5
Dewina Sinaga (Kewing),"Please enjoy its beauty but don't damage it with the rubbish we bring. If you're on a picnic, don't forget to bring your rubbish...don't ruin the beauty with your laziness and stupidity.",Local Guide · 252 reviews · 181 photos,6 years ago,[no_minires_images],5 stars,5
Nidawati WP,Bicycle or electric motorbike rentals are unclear or not well managed. disappointing visitors.,83 reviews · 30 photos,5 years ago,[no_minires_images],2 stars,2
adinda banowati,The place is nice and beautiful enough for a holiday either with family or farewell to school,2 reviews,7 years ago,[no_minires_images],4 stars,4
jday Tsaqif,Visiting the Kumala Island destination is now easier and safer by just crossing the Repo Repo bridge.,"Local Guide · 130 reviews · 1,123 photos",9 years ago,[no_minires_images],4 stars,4
Septiawan Rizki,"This is my first time passing here, the concept is good. There are padlocks on the right and left in the style of young people following westerners",Local Guide · 65 reviews · 4 photos,6 years ago,[no_minires_images],5 stars,5
Less,"The coolest tourist spot in Tenggarong, plus good spots for taking photos, really recommended",Local Guide · 31 reviews · 25 photos,5 years ago,[no_minires_images],5 stars,5
Suriadi Amirdana,A good recreation area which includes recreation areas for families both on holidays and weekends,Local Guide · 7 reviews · 6 photos,7 years ago,[no_minires_images],3 stars,3
Herman Tyo “Herx” Oetomo,The bridge connects between Timbau Road and Kumala Island,Local Guide · 101 reviews · 106 photos,7 years ago,['https://lh3.googleusercontent.com/geougc-cs/AB3l90A4GCKloRRAuLp-EAA-C2p47c4lxCIEwyV27BlINjD7OENA6cgGJnXqhycXPiVdqbWFAvor2TVOPQmTrW1ylm22E7ioPldOfQJPnkBAUEWRh0P30rcA7Wi-jcGUfnfUaNdwIbSI=w600-h450-p'],5 stars,5
Arashi Birdss,"The bridge is great... you can see the view of the Mahakam River, the spot is also good for taking photos",Local Guide · 43 reviews · 5 photos,6 years ago,[no_minires_images],5 stars,5
dila.flawor_12,"Previously, if you wanted to go to Kumala Island, you had to take a boat. Now, you don't have to bother. Because there is a bridge for visitors to Kumala Island.",Local Guide · 25 reviews · 45 photos,5 years ago,[no_minires_images],5 stars,5
Mamiq Jemi,"Beautiful and beautiful, helpful for visitors who don't dare to cross using a chess boat or cable car (unfortunately the cable car doesn't work)",Local Guide · 11 reviews · 10 photos,8 years ago,[no_minires_images],3 stars,3
Jara Kada,"The sensation of crossing by traditional motorboat is more challenging and exciting, but with a bridge it is much more practical and safe.",Local Guide · 315 reviews · 574 photos,7 years ago,[no_minires_images],3 stars,3
dinar a,"The bridge that connects Kumala Island with Tenggarong can only be passed by pedestrians, not motorbikes or cars",Local Guide · 9 reviews · 30 photos,6 years ago,[no_minires_images],5 stars,5
Nawri Gaming,"A very beautiful place to visit, lock the padlock along the Kumala Island bridge, and write the name of your loved one",4 reviews · 3 photos,8 years ago,[no_minires_images],5 stars,5
Neo Aprela,"Exciting..
It's fun to walk across the Mahakam River then go around Kumala Island.🤗 …",2 reviews,2 years ago,[no_minires_images],5 stars,5
adi darmawan,"The bridge is quite good, it's a shame it's not all finished, especially the fountain that we want to build",Local Guide · 21 reviews · 64 photos,8 years ago,[no_minires_images],3 stars,3
Dede nur,The bridge is a good photo spot,Local Guide · 240 reviews · 105 photos,6 years ago,['https://lh3.googleusercontent.com/geougc-cs/AB3l90CPHIaay93EamAgfvNLx0M4ucRQGAgps7-oa30Dbe0-iHQF-jYSSlhzm5vLEPzjO4XC656A8MVuW0gEHJYDcq9avtu-o0Q2A6DgZptZbcOe0m5YKVzRUzueL8L4XeGmgZNpgrkc=w600-h450-p'],5 stars,5
Lianawaty Charlie (Mei li),A healthy and fun tourist spot to spend on holidays & weekends with family and friends,Local Guide · 14 reviews · 25 photos,8 years ago,[no_minires_images],3 stars,3
rudi ansyah,Historical tourist spot,Local Guide · 8 reviews · 31 photos,5 years ago,"['https://lh3.googleusercontent.com/geougc-cs/AB3l90Cxr1DdKZ-_cEzKzRmcYikKASWl7Xq-Ct6uMTYlGzma-Od9n8AKo_iG1gJdV_VkbCYhOWrjcxOepbKBT2IdBwA__U_UbpOYVpEFCZoiIPSxPiu0-n6lnfm-GXxDuITNeusGz6Cklw=w300-h225-p', 'https://lh3.googleusercontent.com/geougc-cs/AB3l90DffpDAvGB_f0zxnLxp9sRkFbYqorijUsVGLQVBtE2t4SkhHjbMVGJJ3GnQ9erliMcqiWvVWKP6nKgok6qkNXANO4MRb4aQsjA1qZFRO99bhlXUju41Uh4Rh8zfjU1JtQsmxXpB=w300-h225-p', 'https://lh3.googleusercontent.com/geougc-cs/AB3l90B_Dwyg8NRuY8aFPLq5fwq87tMj94NWqyWfUw1vWl_Dg6oTIBO8rQICUYFhDXMdoWl3Q_5w7j_qu7TlHyWFLSoX4Ky4uCrHYdJiJXZbvRSBvZE-rafL4AAcp5ltgn2YOgLx5nx5rw=w300-h225-p', 'https://lh3.googleusercontent.com/geougc-cs/AB3l90AN3ME_Jl91f0VEttUQehhE4gRbyZ8tTKm7mGYzIs2dm0uP_VLte85OfB4_3MqWu4Z9fuZN3iff1Tq2B9y-mYkEKtkLbMkFb1oS7AhhLA4lWuhtGnHt-H-kLd49h5BRQYL8CtUgww=w300-h225-p']",5 stars,5
Jul Haidir,"This bridge is also called the pore-pore bridge which means padlock, this is a connecting bridge from Tenggarong city to Kumala ISLAND, great for taking selfies...",Local Guide · 99 reviews · 121 photos,8 years ago,[no_minires_images],4 stars,4
Arief Rahman Hakim,One of the places you must visit when you are in Tenggarong 😁 …,Local Guide · 10 reviews · 81 photos,7 years ago,['https://lh3.googleusercontent.com/geougc-cs/AB3l90Dhr7-Mww-vxHBmgFQISfEZcgiyOH8C0FB9d6VfrWdS-p07jaw5IyDJS5Z37_7fkgYbT2dntf5xXC08KyLT-hSDWJl8kWLO-S6q7hzAc8pif0rEE4k-CfTZvhJLqYVwIQYC2Jdq=w600-h450-p'],3 stars,3
Muhammad Gufron,"A comfortable tourist spot for family and close relatives, clean place and good views",Local Guide · 14 reviews · 6 photos,6 years ago,[no_minires_images],5 stars,5
Her Susanti,Second time here.. Because with friends and family. Even though it was hot and had to walk across.. It felt fun.,Local Guide · 44 reviews · 145 photos,7 years ago,[no_minires_images],2 stars,2
sayf bsy (sayfbsy),"becomes a connecting bridge so that it is easier to get to Kumala Island, the yellow color makes it even more attractive.",Local Guide · 505 reviews · 898 photos,5 years ago,[no_minires_images],4 stars,4
Muraibatu 12,"I've been there but, when I used to ride the cable car I asked for help to have the cable car repaired, thank you♡♡♡",1 review,8 years ago,[no_minires_images],5 stars,5
Agus Tudahlina,Repo2 Bridge is a crossing point to Kumala Island and on the island now the recreational facilities are quite good...,"Local Guide · 230 reviews · 1,882 photos",Edited 6 years ago,[no_minires_images],5 stars,5
desi kurniar,"Nice place, comfortable, and no fear of collapse",Local Guide · 46 reviews · 145 photos,5 years ago,['https://lh3.googleusercontent.com/geougc-cs/AB3l90Ahu6o7iSHNKibmx3RISTvtX78ViwVXS_oowgo9UKkm3u_8ksSXWo4ftqebNEYgZ67TctL_MG0MQB_WqOxCHXWdzLVClpoIklLqq9S-z0pr0pcqsMZcaruK8271SFyIe5gBfjfxrQ=w600-h450-p'],5 stars,5
Pudjianto 79,Good... it would be better if there were lights around the bridge.,4 reviews · 1 photo,2 years ago,[no_minires_images],4 stars,4
Rory Januari,Tourist destinations of the king's city of Tenggarong,"Local Guide · 611 reviews · 1,895 photos",Edited 4 years ago,"['https://lh3.googleusercontent.com/geougc-cs/AB3l90DtESdw8IlJksd66YyRgeEWJ9XAHT-WvKX26zKhcOW99nuJJZ0_uXg_iOQEocw6VLKGuss-n6yafxDB6c5_1dm97bkJqgi6Wyvn60yBzHyPUT4N7sRif0eCopH2BhZhgXOTXoU=w300-h225-p', 'https://lh3.googleusercontent.com/geougc-cs/AB3l90C41VlY984yfsUJ8b1ndK4oa88AQvtQVKnvFtMuDBC14xwzSTGRA5bk_UibTEGW7a0AX5K_bhmxhZ6aqJr5sosnkkCJ1mdoGWqhxx1WQJXq74-LLUxnSasla2X5D19L2pn6mAQh=w300-h225-p', 'https://lh3.googleusercontent.com/geougc-cs/AB3l90ARweRue75om8Wer1-tL_PLoTbrB4HSju_SA_W80ScdfaVAYjRCjwJAFPLKbSFKk-c3PHWDFjiNjNAbdDFTbay_m-mJarSB3jA2-l_gRjXTRasfNrMOfppHoR9ujbsEUqGEplWo=w300-h225-p', 'https://lh3.googleusercontent.com/geougc-cs/AB3l90BFJ0V82ZCPpIuBIRUfoMRwPsIenApHVL7BxknwxeS65GDJZcuJSQ4zU0dRjVwgtbDDZYw2Xk3yVOxO11hNNqXA-EQBTiVt8uEvfJNslS40OfKeNxtkdjCe3LWeacm7TJkGNj4DSQ=w300-h225-p']",4 stars,4
Astian Dana Ahadda,One of the best tourist attractions in Kukar district. The best place for photo spots with couples,11 reviews · 6 photos,5 years ago,[no_minires_images],4 stars,4
R Puspita,"A good place for a holiday with the family, the facilities support the main thing, guaranteed to be relaxing...",Local Guide · 57 reviews · 24 photos,7 years ago,[no_minires_images],5 stars,5
Imam Pink,"It's quite entertaining, especially for our children. There's also one for adults. Increase the comfort and coolness. Tq",3 reviews,5 years ago,[no_minires_images],5 stars,5
Mas Pram,Comfortable to visit in the afternoon while enjoying the afternoon atmosphere on the riverbank and also buying snacks 😂 …,Local Guide · 33 reviews · 69 photos,7 years ago,[no_minires_images],4 stars,4
Auliya Muhammad,"Delicious fried rice in front of Kumala Island bridge, the taste is even better when eaten when hungry.",Local Guide · 37 reviews · 11 photos,5 years ago,[no_minires_images],3 stars,3
Panji Aswan,Fun Travel.,Local Guide · 19 reviews · 18 photos,8 years ago,"['https://lh3.googleusercontent.com/geougc-cs/AB3l90D-ZEZKLQlLf54t1f7r9on1UXtRaHO4wmSMGvfp5q-xK9i327Ph0WZcJ2LO99rZmJ-XH0R6niIMTdLdOnnFmqzW0K0hP0JMk5qgkGU1AHF-_1-p09SJBmrDuAW29JZCe9cScb8P1A=w300-h225-p', 'https://lh3.googleusercontent.com/geougc-cs/AB3l90A_u2yw9iYaDH_4zdFrAKhNoSbWIcbo2gL80VF1gs-nfOIxU1iwIySpJjZpD1capdzYiiSKiqEgUoyDVqcwU8yKOZhBI1Htpmu2uZaCGSsb8bOygseZPvRD8u7DpJe4iNy3U7g=w300-h225-p', 'https://lh3.googleusercontent.com/geougc-cs/AB3l90AwHbbPbCmg-d6oCbbUKaF3JGxmyWOU9lqwADpnM2Kqck8U_J1gLRHshft17AwdgUn6b3bP6rZk--yKJJ_gsARMnzjCsS9XA6y5AUSzFvKHlhWvYdzUsN_Q8ifDjqi4jj0iPTfg=w300-h225-p', 'https://lh3.googleusercontent.com/geougc-cs/AB3l90BSii07Tkm2wtn9-CH0TBYECReFwJj4WOSSJIsKfWvhaTlQ6xUUcFuq7wf-A6zJFk4324s7BwzzNRcLgUAWS9LVNs5J3eakt8bal1xmvp4VIQ4_gSDncFD-f97Sg-SOu0crld5K=w300-h225-p']",5 stars,5
