name,review,contrib,humanized_timestamp,minires_images,stars.label,stars.value
Julia Arsita,"Repo Repo Bridge, the bridge that connects to Kumala Island... there are lots of padlocks hanging on this bridge. The view from the bridge is really good. If you go to Tenggarong, you must come here. Umbrella rental is also provided because when I came here it was quite hot, up to 33°. The parking attendants are also good because they come directly from the transportation department and it becomes more organized.
There is also a road divider on the bridge so it is not disturbed by people passing by",Local Guide · 24 reviews · 75 photos,6 years ago,"['https://lh3.googleusercontent.com/geougc-cs/AB3l90Bm55tghwge2FdfOGkgzuoCmWHj3FcygpfQJCcautAlJcdh4dDyh5o93BzX3aIoVJoDz5VilneZAQnTW9eyYW6OA01az2_kpq2tWJryxtfnynkFFTj9MOV5ANshkmZBocKiOpWPiQ=w300-h450-p', 'https://lh3.googleusercontent.com/geougc-cs/AB3l90BERbX30YrCJ5Ncj5jXMFHz4r3QA69u8GZP6ycuCBz2_oo_ZY_qUGYKeAiOntb8H57ZQPXAEF_27XV-RqBAVVxucHKfkqpQsYuuYqCfgSvcVfopdZKZGvIUjN97w9dHcECZU3Mg7g=w300-h450-p']",5 stars,5
Rosmeilan Siagian,"To facilitate access for Tenggarong residents to Kumala Island, the Repo-Repo Bridge was completed in 2016 as a special pedestrian bridge that stretches over the Mahakam River. In Kutai language, ""repo-repo"" means ""padlock"". Therefore, there are love locks here although not many.
For easier access of Tenggarong people to Kumala Island, Repo-Repo Bridge was completely constructed in 2016 as a pedestrian bridge stretching over the Mahakam River. In Kutai language, ""repo-repo"" means ""padlock"". That's why there are love padlocks here though not many.",Local Guide · 237 reviews · 639 photos,5 years ago,"['https://lh3.googleusercontent.com/geougc-cs/AB3l90ADPC_dGvN-YbQxBPcNk5UzbpQ497FUfRyxzrKHim0mue3NWgoeobwEyjD2yOYG4djMnV10EqB_--K-aqkjETsHBD_vgpl7ZAMleRP5DNyC3-l6jqUms7wH7_wwU42lNRLU1vjz=w300-h225-p', 'https://lh3.googleusercontent.com/geougc-cs/AB3l90CSCXmjb_pkNT8DkkrCloo-KJf68qJEGpl2ztLES_1wZ1HpyQCAl40Vcpz3cS6MGVTjioSXzl-XKViHuJOlp2E1fyI9Qxja82r6YJ-hkOQFBLqFiAo0MjJkoZ4cRYHxqrLtPEt3=w300-h225-p', 'https://lh3.googleusercontent.com/geougc-cs/AB3l90AnCr35442OiTspSg3ilLcIwqq6LPILbMIL03TmkWPdtstups28TKEre-YLFMHddl-2vjiSVeCtnt3ssLv41OHxrF7bSmkuG0x6TXfL2Jk8gKttl0eJxZoFK_x4HaEnW2je9hX5=w300-h225-p', 'https://lh3.googleusercontent.com/geougc-cs/AB3l90B4JWHfbZbipjxgmmyV7A7U_hO9lDZR8JknPT2po56jkQ-3apt3ICTL1hND-jzG2rFSmakRIlgovoLm9h-Uxd0Omr_vMi8_f9LFw84ydFsS3BiM8LJs5oCjLPsbMi5rkVgnRe7Hew=w300-h225-p']",5 stars,5
aditya putra95,The bridge that provides access to the proud tourist island of Kutai Kartanegara is Kumala Island,Local Guide · 26 reviews · 58 photos,5 years ago,"['https://lh3.googleusercontent.com/geougc-cs/AB3l90BBSvtzqSd8cWHbr_HFDir-gnhnC3jY9LzJO-JICsxz6zq6iLMvvCVzhrLpRT7FzrG6O1RIXJcgJHP6yBX0xpIn9zosoGzG5J2aSWe5_hnsRWKXq1vZQH7iJ3mBchuNzmvJkSZQ=w300-h225-p', 'https://lh3.googleusercontent.com/geougc-cs/AB3l90AAXFj_Qgp2YDgdlHrg-h0FwyuIVg_KwP2ty42F7TpxBPIRbjDG4yWEMRPic9XkB8wJPIAfh5leC17eyQNqTPmrHXXN4Dt9LCw9cNobKImo2Ck1BaixQmQLW8Zu387jO2dJVmj-=w300-h225-p', 'https://lh3.googleusercontent.com/geougc-cs/AB3l90AgINLqaEHwsvK4u5q69Hj9DZmY0OHJKf-JEUnIvD7-bekkdG62WBSuQJqKvxxR61AhXRTwpSsN1BkW5c9gHr5WARdCnJRtWZPtippLzXDULT0UnRnVOO7JbGkEljmiikeJRVOB=w300-h225-p', 'https://lh3.googleusercontent.com/geougc-cs/AB3l90AgTGfXoaSWvrv5V_YP3hzobdX7d4n-ipqR5PCi2voCqU9-MtU52_n27q41q8tt63aRWujbgStcubWAsH3VEv1zl9HiiJnM46VtxM6UaKaM__X73bmpEX5Jrm9v_Kls47XvWYg9fg=w300-h225-p']",5 stars,5
Nur Sukma Rangga Pratama,"The place is nice, but this guy is not very friendly... he seemed fierce when we asked what place this was, he didn't answer... In my opinion, I am a tourist from outside Tenggarong who wants to find out the history of Tenggarong and the contents of Kumala Island... oh yeah, this guy is on a motorbike... Hopefully it won't happen to you guys who are going there... Let me be the one who gets treated like this...",Local Guide · 31 reviews · 18 photos,6 years ago,"['https://lh3.googleusercontent.com/geougc-cs/AB3l90ARObfO_JM3zQfnf0yX5OMrInN2JPJAgvuoWTq4e_xFzPep3PoNZdBGkHcAZjolZQdsMBvUW4NX25f1papguhFsdHgwG7WxHvoYg99nKWv4DVOg7VeFTYszzdVCWXIpvNmezmfn=w300-h450-p', 'https://lh3.googleusercontent.com/geougc-cs/AB3l90Ad-s2wWZMq214IvSzkPf2jHwAVJRRHiDSqdi2mpJQAIfajM8Lo-NJwDvzXpaKp8uOto1h8XubDvECejx_QdhiDIBmlMr6vfynTPX6OPdV_d-MMLONYvqZ_6rJLUB9B-efiKFtd=w300-h450-p']",2 stars,2
Afifa Channel,"I like it because the bridge is clean, the view is really beautiful from the top of the bridge, really good for photos""",5 reviews · 10 photos,5 years ago,"['https://lh3.googleusercontent.com/geougc-cs/AB3l90DCo4rJ3zZ5Uwf2njE_cfElRhMhsOCS2q8ClmMaeHwG61_iT778x1fqVA6c9rtPFnKF0w6bzFouB-xDWXilzb_RbPf3iNXB_nQriFo0CUzAxdMPvh-DD0103e5mJmmx39-qkLj4=w300-h450-p', 'https://lh3.googleusercontent.com/geougc-cs/AB3l90AKqjgc7S0lSsGsMFVaj6tkFBjRGZFdRpxU_SvI-QxyNrqQM-q4gRPKB-3wShzUHG95ChLYjwfF4BMVJaeXZS9UbaCiqVYpPUQEDodJM7rS3Dt2wxNgSP1HaS-pvmqgAjNseV-FUQ=w300-h450-p']",5 stars,5
L R,"Since there is a repo2 bridge, it has become very easy to access. A very suitable place if you want to go for a relaxing walk with family or friends. There are many choices of modes of transportation to get around the island, from bicycles to trains. Make sure to use sun block before coming here",Local Guide · 90 reviews · 136 photos,7 years ago,['https://lh3.googleusercontent.com/geougc-cs/AB3l90D3CYSh6W-KRIEtwMOmnZCM7bIHjiJ5c1C4nUZhpTiNl4S4lNdoBEOcLu4YFk_K5WHdHIGqCAooi7Hn3NRxldhwwbYO-BcvtQkCFrZVCYrlA_gps32Msgo1nRxphTdnjqViSCcS6Q=w600-h450-p'],4 stars,4
Rizal Ermiazis Kesuma,"The place is comfortable for relaxing😁 there are bicycles, and several places for photos, and uniquely on the bridge there are hangers (padlocks) …",Local Guide · 75 reviews · 339 photos,5 years ago,"['https://lh3.googleusercontent.com/geougc-cs/AB3l90B20Y0NuCJ5H7XWT2ONQ9nrCoDT1HsWVaR1Nbp7XGE0T6UcgT41AB0OH7urbVKKiQZKn4mahLTP1g2thU80g_Vhpx0yOJnQ-qVhJxbcXagB7rkm9e58N2fVQb0OSKYrSy15yzquCQ=w300-h225-p', 'https://lh3.googleusercontent.com/geougc-cs/AB3l90CNHEzAd6LUSc2IwdepDVeYXP-GuJ_p5QqLz_mYcHJVk1SoVsdol1rHyJrmbXoXh54V3EkXCTeAMYOBXsBSOspxabHv2PQWXZMqTzhpB4_OfVem-hZZ5tzPpMr5HD8M-9Cii4wq=w300-h225-p', 'https://lh3.googleusercontent.com/geougc-cs/AB3l90AAVfC_orSLpeuKn9m-fvM29p9mYlUdeBwwNv0OqHW8VLcHl8VBSGhWAx7tQVq3rL4QqlAse9nvo2xML_IjhBiebLFDhGBOxJuCcp5Ls6xe0fowPUVIolaaneNwZawUYAWyIxk6=w300-h225-p', 'https://lh3.googleusercontent.com/geougc-cs/AB3l90AkV6EEXoWMecRZilbnP1r3Fx94AAFEKMKJyqYTG4Q8Ssp3GHwf7gjRwg7cHVsLkCpvI09IPGXeOHjXQhy4x77EeFr0p63PTKqmFpANakAmGA6B09CnMHneoF74iYqSSpjGRd-Usw=w300-h225-p']",5 stars,5
Ade Yunisah Al Wafazz,"Because this place is a place full of history... and unique for me, this is my first visit to the area where there is a historical site, even though I often go to Tenggarong...",Local Guide · 59 reviews · 11 photos,4 years ago,['https://lh3.googleusercontent.com/geougc-cs/AB3l90ARno6lRF9To_U0Fj0YSzKusm19UvkfX8MbGWxW__U096_lFwX7Brs_yXo054ElrYhV3pqK1TcK0KS_WzHPNZ4PvbI7yMb6NHAu4VEGnu0SbXhKcHqiGlJ7OIPrJq3RErH7pCtgyg=w600-h450-p'],5 stars,5
Fathoni Yasir,"The bridge is good, with this bridge crossing the river to Kumala Island it's exciting... It's not the best, indeed, funding from the government is needed to make this tour even more interesting.",Local Guide · 56 reviews · 160 photos,6 years ago,"['https://lh3.googleusercontent.com/geougc-cs/AB3l90CR1FdTZDGOzJCb0xtfxGrKTY2NKP25KqvFJezDLRLwECmYfA7fCPQsYumxdJjKarzTFyn_cVY4hWPaJdt4yzo0wyuWgw7KK7K4SpmHQM4mjx2oNqhouJum4u50gCxmf9NgpJcqsg=w300-h450-p', 'https://lh3.googleusercontent.com/geougc-cs/AB3l90Bs9dQTK5uZ4CpmcL42o4YB2nCPUNWbTugmWaWCRXLQ-qqBXkEu-igK2LUxZt29BX1LpO-O1teXaC1JnZ3sxcK0FCh7ctcwfp2NJfiGZEBAqGZD5trXlg9LaGR5Wu8Q-v9n0jsYZg=w300-h450-p']",4 stars,4
Wyn Tokex,"Beautiful places around the island, but unfortunately the facilities on Kumala Island are poorly maintained",Local Guide · 62 reviews · 10 photos,2 years ago,"['https://lh3.googleusercontent.com/geougc-cs/AB3l90DROTkvvwsW35oK7hMR0Sr5gJelqJGdJ6JVkGb_-7YjT26JGTWSKv_08oGnM6F3DM_nkWHbFqE7x_NEbietRMGXFh-unYZkFDaKrI_twXviT7txK15lvNE_48sQjRW125iy4ON4eA=w300-h450-p', 'https://lh3.googleusercontent.com/geougc-cs/AB3l90C6Cm3T8yLGbSn42FEPPH3E0yaQGy09FIvcBQfhvSKaF32ZzuJjLc9w-VcyKQqlBh-Mtj9_ORPq0j7SzU5ArTQF6KvKhaRgjfaSef1e77CBnYFLRQdameK4cTT7E0bCpgUUcLE=w300-h225-p', 'https://lh3.googleusercontent.com/geougc-cs/AB3l90AM5x2hGla2PrjROyd3-_-j1QwMtTXUYJSzeU_7_xj3yBzJRS83n4KH-ZCd-CkJaEQEN2rnlc1qmH_Fv9lThvccetssu6TlJ3cJbaKdq9LtK6gilc0DwduyRbfHCTDpV5TGJYiB5A=w300-h225-p']",5 stars,5
Ida Ida,"Parking. Wide. If you're hungry, just eat at the many food stalls. It feels good",Local Guide · 112 reviews · 93 photos,a year ago,"['https://lh3.googleusercontent.com/geougc-cs/AB3l90CgFEJpnAE41ZSMqqH3JYkoZHiUWRztnTgcyFwz6mrpW9hm7KW6kyb0aPjcMJoHdvftJBvwV_943L2bcSBQzwamRvfiLac1EhEbggITO4RIF1ZxJM_LbHkx90voWP3BfCa6Fls=w300-h225-p', 'https://lh3.googleusercontent.com/geougc-cs/AB3l90BPNiJ9-XiJYvJcu_ojnow0Wso2C_D1ADwl6WEsJJgRhntpHcnRj_pkUmrO9eXQW5WmacZaFYVyOM0Szs6FC91XK3Z_wt0PpWu13q9NcdfvkSv0d0rjE_wroHqRllo8MvOZK3jm7g=w300-h225-p', 'https://lh3.googleusercontent.com/geougc-cs/AB3l90Bke5JJEEkxnzWh0Xl0cNELvgUhhZNR7aTUElizzeYe5r7J8O8KsCtE-iBE_WXEhkHWfBIAdd-ubZ9KmGHivfppi05CPPon9Qs1n070wWT3mpRSJh5kBLwK-BxgUDs70Z92qIKe=w300-h225-p', 'https://lh3.googleusercontent.com/geougc-cs/AB3l90CrHYopjSTcmVs1B8Y5KInaXDNOP0iEUWhwgMqF2DCRbpuCgKbDT0L7eUMzqIy3yANNaQXL7xWD2BS2nm-kdb-rz95CjEBIkNIdS8wjMWx5K6kL_sLYh42WKPi3_SXb-yp0Cpc7=w300-h225-p']",5 stars,5
Ahada Almayuda,"Let go of your tiredness...go for a walk with your family, try playing electric bikes with your children and wife, it will be an exciting race because Kumala Island with a radius of 10km can be surrounded in 15 minutes, at the end you can take a photo with the Swana Ox statue in the background, the symbol of the Tenggarong kingdom.",Local Guide · 181 reviews · 449 photos,4 years ago,"['https://lh3.googleusercontent.com/geougc-cs/AB3l90AejQhXH51Apd8c1D4x8xZrqmYrIeLqAiY4MupPlgsE79z8_Jk1jNL0GlcyJXuKgWXCXLgTfCBPtatQDKPwvCEdQ3IA2daW7JnFKjG8QU_qwYmY7FudPbOD9-YH9L9e5g65KA=w300-h225-p', 'https://lh3.googleusercontent.com/geougc-cs/AB3l90BNV6AA92qmaXHYKz3Vf-AvQrzaGrOJqPnq3tdyWu6EilSvVzQebQlzv46FXV7d2VbZrNWmzlaCGGrR13zywfYPmPcr71CppsSkNXlK6JDH6w5w3i0b_u2W-FNQUR6y4jTyULWzag=w300-h225-p', 'https://lh3.googleusercontent.com/geougc-cs/AB3l90A0WFXK0vHnVt6RoylQFGsyExuUELdYhOZJPgrVTa4Kvzy2oOdrzlNz6jffZH1YT188_XhgVwKU-dv4qnzlaVyiYKxiKFjM3hCK-k0z0Fv_aFXzt2ERNB-E-ZGGg55V1piUwZiS=w300-h225-p', 'https://lh3.googleusercontent.com/geougc-cs/AB3l90CGy9zx4Xm3ZsU7KchK0z6BR0S50PBIHm4i_PLfHa91gDt2d-mggqJTU6Jx23rEBCm0L6tMmF1IGbHYbU9RdGDC_8QHCxyg460iK_uN3ctELx5hNN-xcNoCGNrRxIJ5L08mHoAX=w300-h225-p']",5 stars,5
Kurniawan Dwi,"The bridge has also become a tourist attraction.
This bridge is one of the connecting facilities to facilitate access to Kumala Island.",Local Guide · 159 reviews · 424 photos,4 years ago,"['https://lh3.googleusercontent.com/geougc-cs/AB3l90AxZJuY437WOTlNqFE4uuJoaOsiU-SI8-QDtSL8lqVT7ieut8Vj-tWZ8QN9ne8L-XaskRJ-yNUB5PSsstJ7LOkpcOv-HnTtVwk1UPBfLvLIj3PaASqy2QlaIF8ZDgMSqHxE9jqQ7Q=w300-h450-p', 'https://lh3.googleusercontent.com/geougc-cs/AB3l90Ch8e4hlL8fqmgsvfGczOgx8MAEIdNiGPidriDmV366K7unvNxGwXw07V_jR1zq2kDy-CrHk-F0zKWWCmtTPI5NDVGL9GyKa-HtSlH43LqvDXmgtVu9EgrtyR154jyrFze54Tvo=w300-h450-p']",4 stars,4
Anisa Maghfiroh,"This is the first time I've been to this place, I like the view... I would like it even more if the maintenance of the place was improved 😊😊 …",Local Guide · 238 reviews · 533 photos,Edited 5 years ago,"['https://lh3.googleusercontent.com/geougc-cs/AB3l90C1xUXUa0yPGl3mV-EEKwGx0He-u50b9EvvDVX8FEahzrsiwRBHVVcaEpWfNvECuEFtMchLeR941a1kkxtGfNEXQu6Q2IJ4vMiizDAKgU08VcSu7gvZbhXD7nFhUuwbPjfJLwjU6w=w300-h450-p', 'https://lh3.googleusercontent.com/geougc-cs/AB3l90CBaZRCQnktqf0RH4eecy0fPF4s98iBSZwX0Mu5OMluzyKnhRgAYQpnLBdcwzMgJblsu7dvHvRPJ59xvqPrgsgG4pPOo3mLzMaNK54kqZF9ZLxj_8n2LFvLFaRIzHQRrNx6CmY8=w300-h450-p']",5 stars,5
Gamming offical,"a very unique natural view plus a picture of a dragon, come on, hurry up and go on holiday to KuMala Tenggarong Island, East Kalimantan",Local Guide · 34 reviews · 25 photos,5 years ago,"['https://lh3.googleusercontent.com/geougc-cs/AB3l90DaIAV6rqf73b7bEuy-jNP8X_FUIqRd_gMqTJuV1YL979yQZFvj2kwM4hHgeXOVa_l8untNBJDNt0eLkOExqMqh977RseIlBjN3qd8dbYEcziZFJkS9ZwOb0Ptx2eP_qOt-ZJ8H=w300-h450-p', 'https://lh3.googleusercontent.com/geougc-cs/AB3l90CBJhlFihyPBv9Nnh8MhOWC277Pc2y101Vr4909CRnLZiPIKYit4_ESchHOX5dxdAA2A87P7DNK98DozFsKCoKprdvYrzvND4VxNS1NWR_1iQuOm4F4C1TCMQi3GlgwISnI7gvRiQ=w300-h225-p', 'https://lh3.googleusercontent.com/geougc-cs/AB3l90ApT5_vPY4OLeOO4QA6_2n4yGr5dW8c9W0FkcYE2c9udkD26PVHptL4FO6J9IMZc060caZtX4DR8rwcCfstcVNOxjaEjwm4bdGPSSj-2zcoeoVlx1uTgeWP2d2bYTKbFV6PbhlmGQ=w300-h225-p']",5 stars,5
aditya kurniawan,"Pedestrian bridge as a connection to Kumala Island which is located in Tenggarong Regency, East Kalimantan.","Local Guide · 66 reviews · 2,102 photos",5 years ago,"['https://lh3.googleusercontent.com/geougc-cs/AB3l90C-WmT8hLj43dxlJhDcQ0RztfG3i7BPqGrWooanR7G9i3ykhccz6fRkoLnl_yp21TcAOCVWTnn9MyS5z7Ed7kVtashR03K59xisS6qbMUsBrU4kP1OfoSKYixIbB-mE1U5Qyttg1g=w300-h225-p', 'https://lh3.googleusercontent.com/geougc-cs/AB3l90ByQz-v4TCC57rT8NhHqBvugzYDV0Y6QhoOMTewl18V2bXrNYWi_Qq5l4l5MbWxR3SmHvTyIO9O7lu7IxqYeSHGc45pBvOwMjk97MliZRUaYpEXtXJbFlXIMEbEOY0OBTdW3xr8=w300-h225-p', 'https://lh3.googleusercontent.com/geougc-cs/AB3l90AV3eWPbdW3Q4-eksv42HC86jmQn6Kb4WYo-wI3hCQLvhkliAiYAsqezzcXDDFE2U74xYshldYuKWMVXx9IN0Ze3CHheRbydZpr1ONGpFU6qhs3lo36-or2DkABbtqsll4HmtNpjg=w300-h225-p', 'https://lh3.googleusercontent.com/geougc-cs/AB3l90CZHNzwA19AqvKUfgGpja_7782ZYZODOApTpSDzJUbNIGj6xxk5DqH82fl1n24pIefHO_0BvGTOmyYeu0fSCYUy-dpg7sWsufxnm6ElnFM-BJdshoCuJubSRUjAxnW4uEgGWNI0=w300-h225-p']",5 stars,5
Frigate Rario,"This bridge is very unique and comfortable to cross, highly recommended for scenic photos and selfies. Crossing the bridge is free.",Local Guide · 27 reviews · 39 photos,6 years ago,['https://lh3.googleusercontent.com/geougc-cs/AB3l90CAl5sAedZYlRJLMHKJYJgIqMSJ7VUI726lW_P-Y93kpqQofBGsa-89ePOra4dYZBxNThNWGarzh4uUvZs681EJ7oFPWVcSqVsn8TFiZi4aTXILMq92simDhQcLoGCxS12_rkM=w600-h450-p'],5 stars,5
nhonie wahyuni,"If you go to Kumala Island, definitely pass this bridge. If you can't cross, take the Ketinting...I like it here because the wind is light and it's also good for taking photos",Local Guide · 50 reviews · 76 photos,5 years ago,"['https://lh3.googleusercontent.com/geougc-cs/AB3l90BXgazss-CcPJwO_gI-LjbAA8yQ2MH1fKAqmfobEJD9OcaM9XMwafy_IIRS20jJW9-ah4BssmIW2xKT3BABYad2EpCeWwsG2aIkR0hoGuxQFwLnEZFo2J8GUbr7zZZwIbXX52cfhA=w300-h450-p', 'https://lh3.googleusercontent.com/geougc-cs/AB3l90BwYOn7MdeCyqCm7NBc0FKKdEGFc6yz1ZQ9KWqIzWMSWF7ReOuc7TSZOoYORY_zzLLNX_PayC-11SHI5SmFme0agIOBCvkFng8c0x2lEKJM8JS9NLY_MzSmKyzckORoHHRKG6Vq=w300-h450-p']",5 stars,5
je je,"Nice place, at night the bridge is lit. God willing, it's better",8 reviews · 7 photos,6 years ago,"['https://lh3.googleusercontent.com/geougc-cs/AB3l90D9TJTLRP1wEpxxAL6N9doSe6ov1PGKb6dB9PU2mWxK1XQt5GqPgOGZZ-0JVJUTuIV5RTxms3Uk6EP1vOEaGksWm_-ow8wbjMHB-I8dWt-YyjcxXOj38flbsXSU7_T7vHIvxJ5Jxw=w300-h450-p', 'https://lh3.googleusercontent.com/geougc-cs/AB3l90AsuHqYzTMYmxqwn74NhyT6LEAmP8z1UtjB_7aVe2kOuMU6SBrjwh2ml2cE8j0LgVBBrwd38hSmLjwjlVEhtRo8ye3z8y0dOag8lHwNCgAYloF4ZwG46DicFrTf3aV683UGHWI=w300-h450-p']",4 stars,4
innal rahman,The bridge that connects to Kumala Island is very busy with domestic tourists. We can install love locks as has become a trend in one of the foreign countries,"Local Guide · 574 reviews · 2,005 photos",8 years ago,['https://lh3.googleusercontent.com/geougc-cs/AB3l90De3oBbcos6K1SMO-CmmlkeKMhh_Gpra4QM7T0E-IGN5UiW0vWxSNH99Iy1UE0RCBentZ_RB1NzCFXveTp4ciR2Cs5EBuAc1AHGi3qfte0xoOmYfepj1Aa-vF6Z0pTfsE-2FfST=w600-h450-p'],4 stars,4
put tips n trip,"Actually, this place has a good concept, there are islands connected by a bridge inspired by Europe, namely the Padlock of Love Bridge, located in the middle of Tenggarong city on the side of the main road
The parking lot is not maintained, there is no information center, there is only a security post under the bridge stairs. Thank God, they are the friendly ones who provide information to visitors. After crossing, there are different entrance tickets for adults and children.
All the infrastructure facilities have not been maintained for decades, there is a UFO tower, tourist train, water park, bird park. Traditional houses are all neglected and tend to be destroyed.",Local Guide · 56 reviews · 15 photos,a year ago,[no_minires_images],3 stars,3
mawarivaie,"Comfortable recreation area, lots of children's games, close to mosques and places to eat",Local Guide · 23 reviews · 49 photos,7 years ago,"['https://lh3.googleusercontent.com/geougc-cs/AB3l90C9UoJgGozaVGOkKMC9dIwsw3XfcSwgOUHe_255vBfUlzld3LwTcTunJw-rg0M-6uGxpHQBpwg5hYHFNNZjU1vV2fBf64PZCbF7C94cm4h0q9fXZyQn8o53Ts8LhkXoCHM8Ntvl=w300-h450-p', 'https://lh3.googleusercontent.com/geougc-cs/AB3l90CVt9fuPZ3yXG0ggGRZU1iBV6_3jDf-S6IRFh2H_4GDA-jkNiIqxofyew59vDvSCPPVTCVH7bFEyp4umCS8WYGXKN7ePbbF9id2s1RSZjaWCIg705AQA_Mrbj3aRXpWdbXHLk3zYw=w300-h450-p']",5 stars,5
Isna Nur26,"It's good, but don't forget to wear a hat or umbrella, it's usually really hot during the day😁 …",Local Guide · 55 reviews · 481 photos,5 years ago,"['https://lh3.googleusercontent.com/geougc-cs/AB3l90Bz_mB9Di5c6kle0xskprw2wCB3_teJjM_y0FeFrmFX-Dkm2QL7Egq8XUrIs4PR0k8sJUh8YEaKIYvtaNxUYgq1hAtU03Pq9T569GR3qzKSoHpoB01qSQKjh00Zi5T9RE7SL64e=w300-h450-p', 'https://lh3.googleusercontent.com/geougc-cs/AB3l90AgA6KcBc5EJTXVClvoyqV-RSi9aB8JqDPYxI6iLQscpJsDbA_wcphDLoVikmNO0WzRr3hhfuMQsxeV8HESrseSaGIKoiS91k2I3DX3cLWFrOZeLjZD7ij3e4dP4tLChHOi67IM=w300-h450-p']",5 stars,5
Susi Susilawati,"A tourist spot that is still beautiful, the air is fresh when you arrive at Kumala Island",Local Guide · 22 reviews · 24 photos,6 years ago,"['https://lh3.googleusercontent.com/geougc-cs/AB3l90DuIwUkpRVGsQwbovdRpGYOIjTpkYLO763sCuSjd3SEmeGNESALml8K1P6ckGdXhIUGwK7xiRraFABc0rMNfDWPT_d6jLhT_f-4eIpPg8jgjfkzQn3USj1vSMTk5ncukMm8-kuNBw=w300-h450-p', 'https://lh3.googleusercontent.com/geougc-cs/AB3l90AkWLt_Hyr2Zhk8Qku9pP0o_iHC1LwNGPrQm-4uPgMavuAogryq52QbxqHiXBVFFoOpZsNsD0pHaetMoNhcounLxnNihgp70V175wWtPZnucegtHhtHIJfqQTwA8WshL_xG966vPA=w300-h450-p']",4 stars,4
Fathur Rachim,"A good spot for taking photos, unfortunately the management of Kumala Island itself is still far from expectations.

At least it should be in the same class as Nami Island Korea","Local Guide · 555 reviews · 1,425 photos",6 years ago,"['https://lh3.googleusercontent.com/geougc-cs/AB3l90Dj_TX6b4BMXfPeCrYy5-FCOnZ8m3pTU1vC1XIW-eb8lNBCeLEZX-820AFyaxSBtjttAx7HI5xUisc-N3oT_vF74E-j5q5wDIGKKjivOnGE0yL5XEsTkpNeMs6kpWGLQSQ0T4W_=w300-h450-p', 'https://lh3.googleusercontent.com/geougc-cs/AB3l90B7f1bCqjn-uw4QZZKbe3BUgghuDh1Y2EHaLYSKx6m3vdLccFNqQgYRxDs438yCaLqQGXCt0vbAKGUV1xLJfHHnIjwiq7_A4zMCeElF9ZUEhriwZBvaj6ce0of7Bz-lE2wt1t0=w300-h450-p']",3 stars,3
aspar ramjo,"The views are beautiful, the local people are kind and there are lots of beautiful girls",Local Guide · 7 reviews · 16 photos,7 years ago,"['https://lh3.googleusercontent.com/geougc-cs/AB3l90AxzSiKMpz0B8Gc7DLyeN7ewkCHaRgZfUqO0dgGhz_paFrlBn-yVuMBIjD6ejrLQ8cxG8G1T23NxDQx3kyOh6Bp4SUBwNKU7QlhLPdO0FomCylO9Y7MDV5inHjVfDvUsSPvYaLA=w300-h225-p', 'https://lh3.googleusercontent.com/geougc-cs/AB3l90A_Tivu-ihBFR6yCtyErWpdA1TBeCBLTaZWKLeT0DsxaOMNiOkfNN0r4hd7nw8VU9aimqhZTsQIkV7gb-yXRRuNn5Kt0r8zbiE9HzF31w8LMPYOllR4WmVAE7hRH5eM9iACL7NnlQ=w300-h225-p', 'https://lh3.googleusercontent.com/geougc-cs/AB3l90B80P7hKsaRInmb1KXHgRea4HiAM9woz6QJvf4nkhAM9CwNRISnD2TDRZzV6Q5Ct0_LJeiUai4ml4MT0ZpG_jvcA7kXUpOuEkpxqdlmECRgexQn4BEJz0XI7PjDPNybnO463lKC=w300-h225-p', 'https://lh3.googleusercontent.com/geougc-cs/AB3l90Dtnu29wsHyQRlTfTCUGa2ETmfiNssD3SauQqatBZ3CtvmPT8wYusAXaS81OfVb89wl7YQ9GRYiVEvQc7Rfx_PHGfn5ePQZwY-ZFHPa2Adgd1ArwzKXWw29CI2WpuvTRKZptBA=w300-h225-p']",5 stars,5
Anton Prambanan,The bridge that connects the mainland of Kutai Kartanegara to the Kumala delta (Kumala Island) in the middle of the Mahakam river,Local Guide · 91 reviews · 439 photos,5 years ago,"['https://lh3.googleusercontent.com/geougc-cs/AB3l90Ao-QJ3wFIY0VQff1av_J2xRIE_E1uHrv_BEAkxdE8jKR7V-O8PppYpK1-fo8XoQHd2vcWRvNqaq3wHycf4FNrmm6ErHG5gt666i7h13j2Y17P66UHlodI2OdAHxfnKWcSTKBl-=w300-h450-p', 'https://lh3.googleusercontent.com/geougc-cs/AB3l90Abl6xg2m0X2MKYXj5WnwwfIlXVfwpLSALxaf-Ip3a1M_pK0ZqmV6RDkieEZChhKgmyGOqjHGg4MbqMnYYhKkDGOe4y8RYbaKxFf6dHIv-hDikAhCn8uLqc4omSrjrpk8s93vGXIQ=w300-h450-p']",5 stars,5
Seven Tobing,"Nice place, but still lacking in island maintenance",Local Guide · 58 reviews · 405 photos,7 years ago,"['https://lh3.googleusercontent.com/geougc-cs/AB3l90APydNP9LIIVGPrFcRBWhWs21cJIHn_gNHG-13tHJ5Eem3NApKgyv-CZH7uz8rNQPvVUNL6hIU0ucfy_DDQE1ljtAMeNKzpPhm0bVAPtGSH-t6KfwPp_QK5JUI79UXzNplO6Zd6Ww=w300-h450-p', 'https://lh3.googleusercontent.com/geougc-cs/AB3l90Cmp-yVRDRvnFf9CnTOjriLfTro1SLi1pBe7p7mDmD45xrd5FcIOx0FaWvQRJueRgc0y6fhOjd8NIsWQUhRHix9ATR2m7gvNBtWUzxZPITGl1o27YsH689ahQE_94gUbxbz8a8=w300-h225-p', 'https://lh3.googleusercontent.com/geougc-cs/AB3l90BOkzflR5lRbevMoByXIebkZJ15CI6ApghJIsEhvTpVtLaa5Avxr9IKL_9GP5pcYdmQXNy12PxDoUhsBUKcsgKQPFkz-gyIDvsY24EVVqzmNUQXwDBxqxh-73mFS97ZNQmdC54=w300-h225-p']",3 stars,3
Dodi Andi,Connecting Tenggarong with Kumala Island.. now it is easier to travel to Kumala Island because you don't need to take a boat anymore..,Local Guide · 547 reviews · 863 photos,Edited 5 years ago,['https://lh3.googleusercontent.com/geougc-cs/AB3l90DMjIkfQwGLplJVKWmXX8W4-dBiTxHdH3k2ABFys7mGMVFbNQ7JSi7GdDdrPss021vzP_ISt66AYYBmIhsvRgrL11Nh-0WLPXLGV5BRWR6Zm-zpfRonm7CXRP0eWKRZdkBl0DF2=w600-h450-p'],4 stars,4
M. Furqon Azizi,It's good but unfortunately it hasn't been maintained,Local Guide · 66 reviews · 72 photos,7 years ago,"['https://lh3.googleusercontent.com/geougc-cs/AB3l90AFeGXdTUwsDPPzq2-B7wCUqxZnSWtIB1qrdnZijWuH3T1o-odGAvvG81FQYirNaGLpIoTc6nI_rb-meIqxjfmm11Th_3sr3pOdWTAUaBtcyC3jjyVvJGqY8mY8cDjP_SGGJwFz=w300-h225-p', 'https://lh3.googleusercontent.com/geougc-cs/AB3l90DiWJCq685axJtK3JnVJ-BV67xgMlaCBOK00StarS5VgtnB7K73SyQ3lI_MXFkPa3lYTVMWK2G8GNqJu4wRYEIbtTrpBDraDPDKFyShLk0IGVvAQzc8ESf44aSwcpfwF1clVqA_eA=w300-h225-p', 'https://lh3.googleusercontent.com/geougc-cs/AB3l90Cj1Z7AMS1bObC6w8T_sXRXMnfWamdvPxatTuA1qpfx8M5PYBPRiZGaAEY_VUMXYtA1vTOjAtyxh3APeyOhY2b9MJPG0X1oh7NtCPfu7rDVC0hRya5AYPK3mwSEbp55mskJzos1=w300-h225-p', 'https://lh3.googleusercontent.com/geougc-cs/AB3l90ATMpilMem29VQedWr350ub9qhTvtTUj0oLKHF_09YFS6Fwzs3mi3XGVvdv9WDfaSUXwY7Ug2HAufUQUNeMW08yjqJQgBbBZcH8RUicPmrC-Jx82ih5kyOBLSBUa5kR-QQMP8tr=w300-h225-p']",3 stars,3
Nugraha Adi,"Cool, impressive, good for photos",Local Guide · 49 reviews · 143 photos,8 years ago,"['https://lh3.googleusercontent.com/geougc-cs/AB3l90BDKaF8H6jJPOa0MNCTc_eN2YciHSFqLK0KfmMBkXw9LXEqch4IT0QdQHj_wsksJzzsc7sg0BxpTo_XqeUL2V-6dBldepjLMuDRw8KhGsjr5e0zX4I9Hy4S4lMV7miCuMyA62qM=w300-h450-p', 'https://lh3.googleusercontent.com/geougc-cs/AB3l90BnhLmUhIQ1b8S3uaNE3h2Cc6jN-xYqjdAsxjYn-zyoY11I_hmuJoZtYY5T3LztydkpaD6nNcfEmzZ5YDwOYQQGAXWtFJbXurYHMSJEaCvKqucqABNstAoXz8psPfUb1S76hjRC=w300-h225-p', 'https://lh3.googleusercontent.com/geougc-cs/AB3l90BESQBjdaDh9Gu1Q6AQPKQX6Ipk7yWVA2udD_zhp3SvFf9JpI5xCo-1H_5CSdG3cjF6gGnGgzW7RRRUxLpn88KSzNyKI0DkaVXNEoYXUOiuikSqgLfTrtO6TJtkSjz-7tCZXBkgNg=w300-h225-p']",5 stars,5
M. Yusuf Aditya P,Nice spot for photos. The entrance ticket is cheap. Bring a hat or umbrella. Those who want to bring a love padlock can do so hahaha,Local Guide · 248 reviews · 91 photos,8 years ago,['https://lh3.googleusercontent.com/geougc-cs/AB3l90DFMUUrtR_31veBExd1NpCwawXMvWqZlNgvizr2oZcJ9qqt5IrP6x6xHBcZrZyHQ14iBALnAUYA9Zwyi2Db4s7sWH4IF4O5oMXCjlNn8oEiItFDiUIMUD9GIze63-_t-wAE6J2e=w600-h450-p'],5 stars,5
Sapnur,"Selling a story by hanging a padlock, then giving it a name, is said to be a prayer for those who put it up",Local Guide · 27 reviews · 82 photos,2 years ago,['https://lh3.googleusercontent.com/geougc-cs/AB3l90BKwZsH0pMjlLaxN7kv6BqSTlFj8l355ChlbZsWEvwy8PBzSrt-KVu8SrCw4FvxrUGRR-i88zuGV6d-OfxDXc8GNePHaFIZeoUkWMwo12o2lICaAR0H3WicidWPm2M9t5JaKHs=w600-h450-p'],4 stars,4
Sandy Septian,"The island's tourist attractions are quite extensive and offer a variety of recreational activities. For those of you who like taking photos, there are many interesting spots to take photos.",Local Guide · 16 reviews · 13 photos,6 years ago,['https://lh3.googleusercontent.com/geougc-cs/AB3l90CZjVPxbBDVJH1omh33nf7AGTpqdXdtqvC8eD-Yy9T1L8aQw6khTQLakgo0_dleDkgdm9mRN5uv8Gp7ZG1ngY-Z9ByBvzfGqoaUP-jsrQiwXXM38Xr-s0YcqbqWISXECaMn6cHg=w600-h450-p'],5 stars,5
Titin Atien,This tourist spot is quite cool and can relieve boredom when leaving the mine or palm oil plantation before heading to the city of Samarinda,Local Guide · 273 reviews · 431 photos,5 years ago,"['https://lh3.googleusercontent.com/geougc-cs/AB3l90CK178gfQeBuSSFHcoqo6FUlPcrFpaFAfPFnepnwzAejRA7HGJwSRc-URl-StTh7FZGL3SDiuy8ChfGwbHJhzwC7JQWc6t5OM4GQErnptKhP9ljf1ky-WSjnah5Iuo7gbBDwnNW=w300-h225-p', 'https://lh3.googleusercontent.com/geougc-cs/AB3l90C6oJzCa5kDPvvrqSvknxzTKjLScVXyTznfSJvPEOXgd6y-WgeeKhDtMKreUYvz6UOEfAFo5QFWfhqSufmo-lwFdQ22TXeTPAlefORlTK_HYbaYS7HJxutbNUCyGMnz1w5RyTZ_=w300-h225-p', 'https://lh3.googleusercontent.com/geougc-cs/AB3l90DfXeRFr7TNvZKTWWeIVfX1TK5fz9nrHx_NhRoe7W2NLNySxzVu-1cfWUxJV3uH0W1JcQVPmfyN_LBnI_IDrg5cvVXsgb96l840EhJK2yJp-LNA3uuj70uCdX64mxPOT966VB3L=w300-h225-p', 'https://lh3.googleusercontent.com/geougc-cs/AB3l90BY9kQJZyOSYDKIB_1RBInxhlTrXPXvDWPY13eY4Y4fqet61jn7y3Yd-390ziq39MgmYNhFZMGUOa0yht0smR0Bsr0LgJdsP4tW321fnO0HRQQzUoh-OZK4M3ZlNW5A__3d59HC=w300-h225-p']",5 stars,5
